hospital_id,district_id,hospital_name,address,pincode,latitude,longitude,mco_contact_number,total_beds,hospital_type,government_subtype
503,30,GETWELL FRACTURE & ACCIDENT HOSPITAL,"JALKEWADI , NEAR TALATHI OFFICE , KANKAVLI - 416602",416602.0,16.3153191,73.6200283,9422393139.0,30,Corporate,
504,29,"GHOTAVADEKAR HOSPITAL,SANCHIT ICU,NIRAMAY DIALYSIS CENTRE,CARDIWIN CATHLAB","425,NEAR MAHAGANPATI MANDIR,MENAVLI ROAD,WAI,TAL.WAI,SATARA",412803.0,17.879632,74.010916,9822294184.0,50,Corporate,
505,15,GIRIJA HOSPITAL,"GIRIJA HOSPITAL,99/1A,Peth Vadgaon,DR CHOUGULE COMPLEX,opposite s.t.stand,KOLHAPUR",416112.0,16.60630039894737,74.30376235873685,9823284502.0,32,Corporate,
506,29,GIRIJA HOSPITAL MULTISPECIALITY CENTER,"Plot No. 7625, MALHAR PETH, POLICE HQ TO ST STAND ROAD, NEAR POLICE HQ %E2%80%93 415002",415002.0,17.6767,74.00425,9822037390.0,35,Corporate,
507,14,GIRNARE HOSPITAL,"GIRNARE COMPLEX,BHOKARDAN,BHOKARDAN",431114.0,20.254098,75.768988,9420907057.0,30,Corporate,
508,6,GITE ACCIDENT MULTISPECALITYAND TRAUMA CENTER,"DATT NAGAR, NAVAGAN COLLAGE ROAD %E2%80%93 431122",431122.0,19.839128,75.890447,9970026328.0,30,Corporate,
509,17,GLAZY HOSPITAL & NURSING HOME,,,19.446040649122807,72.36373664912281,,49,Corporate,
510,22,GLOBAL NURSING HOME,"1,TRIMUTRI CHOWK,AMBAD LINK ROAD,PADMA HOTEL,",422009.0,19.988439,73.720725,9011060788.0,50,Corporate,
511,15,GLOBAL ORTHOPAEDICS AND ORAL CARE CENTRE,"3, BHUDARGAD COLONY, OPPOSITE BARDESKAR PETROL PUMP, Bhudargad, Kolhapur-416209",416209.0,16.60630039894737,74.30376235873685,7500570025.0,15,Corporate,
512,20,GODAVARI INSTITUTE OF CRITICAL CARE MEDICINE (GICCM) HOSPITAL,"NEAR HINGOLI GATE,NEAR HINGOLI GATE,town market society,NANDED?%27,%27HSI67212%27)",431602.0,19.2,77.4,7499727676.0,30,Corporate,
513,16,GODAWARI MULTISPECIALITY AND CRITICAL CARE CENNTER,"KHARDEKAR STOP, AUSA ROAD, LATUR",413531.0,18.37795,76.50265,9689520990.0,30,Corporate,
514,13,GOLDCITY HOSPITAL - UNIT OF NETRAM EYE CARE HOSPITAL PVT.LTD.,"Yash Plaza,Near Govinda Rickshaw stop Jalgaon",425001.0,20.46428,75.004181,7249673019.0,0,Corporate,
515,13,GOLDEN HOUR HOSPITAL MULTI SUPER SPECIALITY CRITICAL CARE UNIT,"BHUSAWAL DNYANRANJAN TOWER ANAND NAGAR BHUSAWAL, SURANA BUILDING, 425201",425201.0,20.76134140182927,74.84583924085365,7665552388.0,30,Corporate,
516,16,GORE KAN NAK GHASA V DANT HOSPITAL,"MITRA NAGAR , MAIN ROAD , NEAR TAHSIL OFFICE - 413512",413512.0,19.968664,73.831608,9422014580.0,10,Corporate,
517,23,GOVERNMENT MEDICAL COLLEGE,"marwad gali near bhim nagar,osmanabad",413501.0,18.408779,76.559758,9422934323.0,236,Government,DHS
518,11,GOVERNMENT MEDICAL COLLEGE,"Nehru chauwk ,infront of navin prashashkiy imarat",441601.0,21.484894,80.251647,9823169131.0,180,Government,DMER
519,4,GOVERNMENT MEDICAL COLLEGE AND CANCER HOSPITAL,,,19.944847311671925,75.41925964069401,,100,Government,DMER
520,22,GRAAVITY MULTISPECIALITY HOSPITAL PVT LTD,"FOURTH FLOOR, SHRI HAREKRISNA PLAZA, OPPO OLD ADGAON NAKA,KATYA MARUTI CHAUK,PANCHAVTI NASHIK,HIRAWADI ROAD",422003.0,20.080116,74.109816,9975832812.0,44,Corporate,
521,31,"GULVE HOSPITAL,Malshiras,Solapur,Pvt,Solapur","GAT NO 115/1/2,PLOT NO 2A, AKLUJ- MALSHIRAS  ROAD, NAER SAI MANDIR, Akluj, Malshiras, Solapur -413101",413101.0,17.477512,75.298578,9890075709.0,20,Corporate,
522,25,GUNJKAR MULTISPECIALITY,"315 SEC 18 SHIVTEJ NAGAR, SPINE ROAD, OPPOSITE GHARKUL, CHIKHALI, Pune - 411019",411019.0,18.6395,73.79586111,9767092120.0,65,Corporate,
523,7,"GURJAR BALRUGNALAYA,Buldhana",Mutthey Lay Out behind Bus Stand  Buldhana,443001.0,20.5336389,76.1794722,9673839043.0,31,Corporate,
524,30,GURUKRUPA HOSPITAL,"1212,KALMATH ,KANKAVLI,GOSAVIWADI ROAD,NEAR POLICE STATION KANKAVLI,SINDHUDURG",416602.0,16.3153191,73.6200283,9822384884.0,30,Corporate,
525,20,GURUKRUPA SUPER SPECIALITY HOSPITAL,"In front of Bannalikar/Tulsi Hospital, Doctor Lane, ST BUS STAND ROAD, - In front of Bannalikar/Tulsi Hospital, Doctor Lane, ST BUS STAND ROAD, - 431601",431601.0,20.554431,74.512024,9423112433.0,42,Corporate,
526,16,GURUMAULI MULTISPECIALITY HOSPITAL,"B7/701, VASANTRAO NAIK CHOWK PANCHMUKHI HANUMAN MANDIR RING ROAD LATUR, NEAR RAJIV GANDHI CHOWK LATUR %E2%80%93 413512",413512.0,19.968664,73.831608,9766166616.0,35,Corporate,
527,7,Gabhane Hospital,"Dongaon Road Mehkar,Mehkar?%27,%27HSI85363%27)",443301.0,20.13966,76.563,9422926222.0,40,Corporate,
528,33,Gabhane Hospital Washim,"Near Laxury Bus Stand , Washim - 444505",444505.0,20.17,77.17,7875116699.0,30,Corporate,
529,34,Gadda Hospital Digras,"Near Nagoba Mandir,Gandhi Nagar,Digras,YAVATMAL 445203",445203.0,20.1051666,77.7135833,9422167968.0,10,Corporate,
530,8,Gadegone Orthopedics Surgery & Accidental Hospital,"Vivek Nagar,Mul Road,MAchhi nala,CHANDRAPUR",442401.0,19.9465278,79.2985556,9422135904.0,20,Corporate,
531,20,Gaikwad Hospital,At Post Degloor Tq Degloor Dist Nanded,431717.0,19.2,77.4,9423439158.0,40,Corporate,
532,17,Galaxy Multispeciality Hospital,,,19.446040649122807,72.36373664912281,,50,Corporate,
533,4,Galaxy Superspeciality Hospital & Research Institute,,,19.944847311671925,75.41925964069401,,50,Corporate,
534,15,"Ganga Prakash Hospital, Kolhapur","%C2%A0T.P SCHEME NO.2 , Plot No 140 , A ward , Rankalavesh , Dhudhali , Kolhapur , 416012.",416011.0,16.60630039894737,74.30376235873685,9423281787.0,50,Corporate,
535,6,Ganganarayan Superspecility Spine Hospital,"1_7_910 , Vidyanagar (East_, Barsi Road , - 431122",431122.0,19.839128,75.890447,8855883666.0,42,Corporate,
536,9,Ganpati Hospital and ICU,"City survey no 3497/8 - Shirpur,Near bus stand,Main road -425405",425405.0,21.3673,74.83075,7588003617.0,35,Corporate,
537,14,Ganraj Hospital and Orthopedic Center,"Jafrabad Road , Bhokardan - 431213",431213.0,20.3326,75.71382,9403088651.0,10,Corporate,
538,25,"Gawade Multispeciality Hospital,Khed,Pune,PVT","PABAL ROAD, RAJGURU NAGAR, NEAR IDBI BANK, TAL- KHED, PUNE-410505",410505.0,18.988502,73.63596,9890899799.0,44,Corporate,
539,16,Gayatri Superspeciality Hospital &Critical Care Centre Barshi road latur,Barshi Road Latur,413512.0,19.968664,73.831608,9970166595.0,50,Corporate,
540,29,Geetanjali Hospital,"2410/B ,siddhanathwadi near S,T stand wai?%27,%27HSI66955%27)",412803.0,17.879632,74.010916,9850065626.0,35,Corporate,
541,15,"Gem Hospital Care & Cure Center, Kolhapur","923(KH),B.Ward,V.H.L Road ,Azad Chowk,KOLHAPUR",416012.0,16.41294444,74.13072222,7620083799.0,48,Corporate,
542,3,General Hospital - Amravati,"Ervin Chouk,Camp Road Nr. Ambedkar Statue amravati",444601.0,20.9298611,77.7523056,9960616532.0,379,Government,DHS
543,9,General Hospital Dhule,"Chakkarbardi, Malegaon Road, Dhule",424006.0,20.72714,74.7239,9823127141.0,545,Government,DMER
544,17,"General Hospital Malvani, Dist. Mumbai",,,19.446040649122807,72.36373664912281,,60,Government,
545,18,General Hospital Rajawadi,,,19.11878330833333,72.87393688666666,,580,Government,MCGM
546,35,"General Hospital Shashtri Nagar, Dombivli","R-15, Kopar Rd, Lodha Heaven, Shastri Nagar, Dombivli West, Dombivli, Maharashtra 421202",421202.0,19.2215556,73.0830556,9821736446.0,120,Government,
547,16,General Hospital Udgir,"295/1 naded bidar road,near BSNL office, infront of Shivaji college, Udgir",413517.0,18.3710497,77.134958,2385256428.0,100,Government,DMER
548,32,General Hospital Wardha,"Itwari Road, wardha?%27,%27HSI1189%27)",442001.0,20.7531062,78.511073639779,9822857968.0,256,Government,DHS
549,7,"General Hospital,Khamgaon","SH-24, Buldhana Warwand, Shegaon Rd, Khamgaon, Maharashtra",444303.0,20.348496,76.113151,8975301975.0,220,Government,DHS
550,25,Get Well Multispeciality Hospital,"Pune-Nashik Highway,Manchar,PUNE",410503.0,19.034215,74.2211,9970794340.0,60,Corporate,
551,35,Global Care And Welfare Hospital,,,19.295112535714285,73.01962990809524,,30,Corporate,
552,17,Gokuldas tejpal hospital,,,19.446040649122807,72.36373664912281,,521,Government,DMER
553,17,Goregaon (Topiwala) Municipal Maternity Home,,,19.446040649122807,72.36373664912281,,30,Government,
554,2,Goverment Medical College and Hospital Akola,"347,near ashok vatika,collector office road,Near District Jail,AKOLA?%27,%27HSI5249%27)",444001.0,20.71,77.0,8087446659.0,500,Government,DMER
555,13,"Government Medical College & Hospital , Jalgaon","District Hospital, JalgaonOld B J Market, Jaikisan Wadi, Jalgaon, Maharashtra",425001.0,20.46428,75.004181,8788304962.0,350,Government,DHS
556,28,Government Medical College & Hospital Miraj,"Miraj Pandharpur Road, Miraj",416410.0,17.0348056,74.6018333,9921411355.0,500,Government,DMER
557,30,Government Medical College Bambolim Goa,"Bambolim,SINDHUDURG",403202.0,15.4643056,73.8580278,9823574626.0,1200,Government,
558,21,Government Medical College Nadurbar,"NH753B, Dudhale Shivar, Nandurbar, Maharashtra?%27,%27HSI7106%27)",425412.0,21.3122,74.21885,9011804961.0,200,Government,DHS
559,30,Government Medical College SINDHUDURG,"Near District Police Headquarters Lake, Post, Barrister Nath Pai Rd, Police Line, Oros, Maharashtra?%27,%27HSI2373%27)",416812.0,16.1117593,73.6886442,9422416949.0,200,Government,DHS
560,12,"Government Medical College and HospitaL, Hingoli.","Milind Colony, Shree Nagar, Hingoli, Maharashtra?%27,%27HSI6751%27)",431513.0,77.1476,19.79908,9765138433.0,200,Government,DHS
561,25,"Government Medical College and Hospital ,Baramati ,Pune, Govt","107, MIDC Area, Opposite Mahila Hospital, Baramati, Pune-413133",413133.0,18.10683,75.77747,8208950879.0,536,Government,
562,36,Govt Hospital Kasa,"Patil Pada, Kasa, Maharashtra?%27,%27HSI69717%27)",401607.0,19.9128824,73.0464309,9158453909.0,50,Government,
563,19,Govt Medical College and Super Specility Hospital Nagpur,Near Tukadoji Squre,440003.0,21.12283333,79.08502778,9975596195.0,180,Government,DMER
564,4,Govt medical college and Hospital Aurangabad,,,19.944847311671925,75.41925964069401,,500,Government,DMER
565,35,Govt.Mat.Home Ulhasnagar-4,"Ulhasnagar-4,Ulhasnagar,Thane?%27,%27HSI69747%27)",421002.0,19.2380278,73.1588611,9967438317.0,50,Government,
566,19,Govt.Medical College Hospital Nagpur,Medical chouk Hanuman Nagar,441401.0,21.216577,79.153795,8766812072.0,1401,Government,DMER
567,17,Grant Medical College and JJ group of hospitals,,,19.446040649122807,72.36373664912281,,1352,Government,DMER
568,22,Gupta Medicare Multispeciality Hospital,"Plot No. - 08 , Siddhivinayak Nagar, Sakora Road , NANDGAON, City Survey No 3001/02 , NANDGAON, 423106",423106.0,20.306386,74.65593,7887707704.0,40,Corporate,
569,28,"Gurav Hospital,Sangli,PVT","VIJAYPUR ROAD,BEHIND GANESH TEMPLE,JATH",416404.0,17.13,75.22,9158888169.0,35,Corporate,
570,17,Guru Nanak Hospital and Research Centre,,,19.446040649122807,72.36373664912281,,120,Corporate,
571,35,Gurukripa Hospital,,,19.295112535714285,73.01962990809524,,40,Corporate,
572,25,"H.B.P. Prabhakar Malharrao Kute Memorial Hospital,Akurdi","SURVEY NO 170/171A, MHALSAKA, NT COLLEGE ROAD, CAMBRIDGE INTERNANEARTIONAL, AKURDI, HAVELI, Pune-411035",411035.0,18.65388889,73.78141667,9922501316.0,100,Government,
573,7,HAKIMI MULTISPECIALITY HOSPITAL,"HANUMAN CHOWK ,NEAR HANUMAN TALKIES 40 BIGHA,BULDHANA  443101",443101.0,20.7078,76.2097508,9860950689.0,35,Corporate,
574,16,HALNIKAR MULTISPECIALITY HOSPITAL,"R/L 256330, OLD RENAPUR NAKA, VYENKATESH NAGAR, AMBAJOGAI ROAD, 413512",413512.0,19.968664,73.831608,8149470472.0,30,Corporate,
575,1,HARAL MULTISPECIALITY HOSPITAL,"OPP. TO JADHV PETROL PUMP, AHMADNAGAR KALYAN ROAD %E2%80%93 414001",414001.0,19.1627778,77.3060556,9404755355.0,41,Corporate,
576,35,HARDEV HOSPITAL,"Siddhivinayak Nagar, Prashant Nagar, Sadguru Nagar, Diva, Thane, Maharashtra",400612.0,19.1194423,73.0582298,9022767667.0,17,Corporate,
577,1,HARISHCHANDRA MULTISPECIALITY HOSPITAL,"16/6/1,AKOLE,K.G.ROAD,AKOLE,K.G.ROAD,NEAR BY GADAKH SHORUM,",422601.0,19.516069,74.005775,9623927177.0,100,Corporate,
578,7,HARKUT CHILDRENS HOSPITAL,"01,  NEAR UNITY MRI, BUSS STAND ROAD, JAMBHARUN ROAD,443001",443001.0,20.5336389,76.1794722,7083639544.0,20,Corporate,
579,25,HARSH HOSPITAL,"A TODKAR GARDEN BIBWEWADI KONDHAN ROAD, PUNE-411307",411307.0,18.56578105076228,73.89409255768733,9422032217.0,15,Corporate,
580,25,HARSH MULTISPECIALITY HOSPITAL,"CHAUFULA, NEAR NH65, DAUND, PUNE-412203",412203.0,18.529252,74.336752,9975198515.0,30,Corporate,
581,13,HARSIDDHI MULTI SPECIALITY HOSPITAL,"Plot No 518/6/1 , Ranchhod Nagar Behind Panchmukhi Hanuman Mandir Sindhi Colony Road, Jalgaon 425001",425001.0,20.46428,75.004181,9356618892.0,30,Corporate,
582,17,HARYANA FOUNDATION AND RESEARCH CENTRE,,,19.446040649122807,72.36373664912281,,18,Corporate,
583,18,HCG APEX cancer centre,,,19.11878330833333,72.87393688666666,,119,Corporate,
584,22,HCG Manavta Pvt Ltd,"HCG MANAVATA CANCER CENTRE,OPP. MAHAMARG BUS STAND, MUMBAI NAKA, NASHIK.",422004.0,20.2041737,73.8271949,7888009079.0,50,Corporate,
585,19,HCG NCHRI cancer centre,"Nath Ambazari Rd, Near Shankar Nagar Petrol Pump, Shankar Nagar, Nagpur, Maharashtra?%27,%27HSI11226%27)",440010.0,21.12566667,79.05777778,9823280081.0,30,Corporate,
586,35,HEAL LIFE MULTI-HOSPITAL AND HEART CARE CENTER,"419R/200320, BHIWANDI, kalyan road, BHIWANDI HEALTH CARE HOSPITAL %E2%80%93 421302",421302.0,19.2103751,73.0464259,8983394100.0,50,Corporate,
587,22,HEART & SOUL SUPER SPECIALITY HOSPITAL,"GAGANGIRI COMPLEX , EKATMATA CHOWK , CAMP ROAD , MALEGAON,camp road,NASHIK",423203.0,20.5533619,74.5080312,8919038585.0,40,Corporate,
588,3,HI TECH MULTISPECIALTY HOSPITAL & R C,"Rajapeth,Dastur nagar Road Nr Nanda Market",444606.0,20.93,77.77,7212676416.0,65,Corporate,
589,34,HIRACHAND MUNOT MEMORIAL CRITICARE HOSPITAL,"NEAR DARDA UDYAN, DARWHA ROAD, 445001",445001.0,20.4131111,78.1337777,9075070066.0,100,Corporate,
590,25,HSHC LLPs OMKAR HOSPITAL,"422/2221, SANT TUKARAM NAGAR,OPP SWAMI SAMARTH MATH, WADILAL BUS STOP,PIMPRI PCMC PUNE, Haveli, Pune-411018",411018.0,18.6325,73.82083333,9096544446.0,30,Corporate,
591,17,Habib Hospital,,,19.446040649122807,72.36373664912281,,68,Corporate,
592,17,"Haji Mohammad Haji Siddik Maternity Home,",,,19.446040649122807,72.36373664912281,,30,Government,
593,20,Halikar Hospital,"2312, Old Bus Stand Road, Shahaji Nagar, Nanded - 431717",431717.0,19.2,77.4,9405773293.0,10,Corporate,
594,35,Hare Krishna manavkalyan multi speciality hospital,Ganesh nager Diva Agasan road Chaitanya Appartment103/1 Diva East Thane Maharashtra 400612,400612.0,19.1194423,73.0582298,9987251923.0,35,Corporate,
595,15,"Hattarki Hospital, Gadhinglaj","RS.NO.97/1A PLOT NO.4&5,BHADGAON ROAD,RAM MANDIR,NEAR GHALI COLLEGE GADHINGLAJ,KOLHAPUR,",416502.0,16.60630039894737,74.30376235873685,9823884616.0,50,Corporate,
596,31,Hegade Hospital akluj,"99/1/B/1/P/35/36, 100 Feet Bypass Road, Audumbar Nagar , Akluj, Malshiras, Solapur-413101",413101.0,17.477512,75.298578,9096645404.0,35,Corporate,
597,35,Highway Hospital and Multispeciality centre,"Devashish Appartment, Marathon Circle, Near Luis Wadi, Eastern Express Highway, Teenhath Naka, Thane, Maharashtra",400602.0,19.1993056,72.9793333,9820448541.0,50,Corporate,
598,22,Hindu Hriday Samrat Balasaheb Thakre Rugnalaya,Nashik Road - 422101,422101.0,19.968664,73.831608,9850226370.0,200,Government,
599,17,Hindu Hruday Samrat Balasaheb Thakre Trauma care Municipal Hospital Jogeshwari East,,,19.446040649122807,72.36373664912281,,304,Government,
600,15,Hiremath Hospital,"38713161A,URDU HIGHSCHOOL,SANJEEVAN HOSPITAL,KOLHAPUR",416101.0,16.60630039894737,74.30376235873685,9423647222.0,50,Corporate,
601,11,Hope Heart Hospital,"RELIANCE PETROL PUMP AMGOAN ROAD,GONDIA -441601",,21.302498825748504,79.9048506275449,8275290926.0,30,Corporate,
602,19,Hope Hospitals,"Plot no: 2, Kamptee Rd, Teka Naka, Nagpur, GO GAS STATION Maharashtra 440012",440012.0,21.41470797226994,78.84095818131902,9373111709.0,100,Corporate,
603,28,Horizon hospital,"S.No.338 , 2B, A1B1 Dhamni Road, 3rd lane,  Sangli Miraj Kupwad ( M Corp. ) , Miraj Sangli , Dist - Sangli - 416416",416416.0,17.0348056,74.6018333,9371621038.0,50,Corporate,
604,15,"Hridam Multispeciality Hospital,Karvir,Kolhapur,Pvt","383/K,  E WARD, 13TH LANE RAJARAMPURI, KOLHAPUR-416008",416008.0,16.68958333,74.24847222,9307817954.0,30,Corporate,
605,15,Hridaya Multi-Speciality Hospital & Research Center,"Gat no.1096 A,HERLE,Kolhapur-Sangli Road HERLE,High-way Touch,KOLHAPUR",416005.0,16.60630039894737,74.30376235873685,9823016250.0,18,Corporate,
606,31,Hrudayam Superspeciality Hospital and Research Center,"8372/ G, Opp. Vijay Clinic 146/2 Railway Lines , Solapur - 413001",413001.0,17.6659167,75.8943333,8444894955.0,36,Corporate,
607,20,ICON MULTISPECIALITY HOSPITAL,"Plot no. 03 no. 25 purusharth cop. Of housing sociaty javahar nagar, sathe chouk, Nanded",431601.0,20.554431,74.512024,9833983243.0,40,Corporate,
608,12,ICON Multispecility Hospital,"Haji Sk Ismail Comlex Pensionpira Hingoli,Ismail Comlex,Pensionpira Hingoli",431513.0,77.1476,19.79908,8856814329.0,30,Corporate,
609,16,ICON superspeciality hospital latur,"Near Dayanand College, shivaji chowk, barshi Road Latur-413512",413512.0,19.968664,73.831608,7083424818.0,25,Corporate,
610,35,IDEAL GENERAL HOSPITAL,,,19.295112535714285,73.01962990809524,,400,Corporate,
611,17,IKSHANA NETRALAYA PVT LTD,,,19.446040649122807,72.36373664912281,,10,Corporate,
612,4,IMMICARE MULTISPECIALITY HOSPITAL,,,19.944847311671925,75.41925964069401,,35,Corporate,
613,1,IMPULSE PLUS HOSPITAL PVT.LTD,PLOT.NO.11 SAVEDI NAKA MANMAD ROAD SAVEDI AHILYANAGAR 414003,414003.0,19.1162222,74.7353611,9822839854.0,65,Corporate,
614,1,INDO IRISH HOSPITAL,"TAPOVAN ROAD , JONDHALE FARM, NANA CHOWK, AHMEDNAGAR- 414003",414003.0,19.1162222,74.7353611,7757863786.0,170,Corporate,
615,25,INDRESHWAR SUPER SPECIALITY HOSPITAL PVT.LTD,"Dhanvantari Plaza Vighnaharta Nagar Old National Highway, Indapur, Dist- Pune- 413106",413106.0,18.102174,75.095159,7588034800.0,35,Corporate,
616,27,INFIGO EYE CARE HOSPITAL,"SHOP NO -3,4,5  SHANTADURG SANKU;SALVI STOP, MAIN ROAD %E2%80%93 415612",415612.0,17.01779,73.27482,9372766504.0,5,Corporate,
617,15,INGALE SURGICAL HOSPITAL AND LAPROSCOPY CENTER,DEBONCE CORNER JAYSINGPUR SHIROL KOLHAPUR 416101,416101.0,16.60630039894737,74.30376235873685,7028917628.0,30,Corporate,
618,35,ISHA EYECARE PVT LTD,"2ND FLLOR, PRABHAT PLAZA, NEAR WALFARE CENTRE,OPP. NAVARE ARCADE,SHIV MANDIR ROAD, - 421501",421501.0,19.2072778,73.18275,8657953522.0,10,Corporate,
619,4,ISHWAR INSTUTUTE OF HEALTH CARE,,,19.944847311671925,75.41925964069401,,30,Corporate,
620,19,Icon Hospital,"Icon Hospital,K12, Amravati Road,Bharat Nagar,Amravati Road,kinkhede layout,NAGPUR",440033.0,21.1521944,79.0691667,8275044877.0,60,Corporate,
621,34,Icon Hospital Pusad,"3895,Pusad,New Doctor Line Pusad,NAIK SQUARE PUSAD,YAVATMAL",445204.0,19.9088611,77.5718055,9822363149.0,30,Corporate,
622,4,Ikon Multispeciality Hospital pvt Ltd,,,19.944847311671925,75.41925964069401,,30,Corporate,
623,19,Imamwada Isolation Hospital In Rambagh,Imamwada Isolation Hospital In Rambagh - 440003,440003.0,21.12283333,79.08502778,9325853351.0,40,Government,
624,25,"Indapur Criticare Center, Pune","A44,indapur,pune",413106.0,18.102174,75.095159,9156101414.0,50,Corporate,
625,25,"Indian Institute of Metabolic Sciences & Dr. Todkar Multispecialty Hospital (A Joint Venture of PMC and JT Foundation),Pune,PVT","Survey No. 33, Pan Card Club Road, Next to Malpani M-Agile, Pune-411045",411045.0,18.568623,73.766606,9823390505.0,150,Corporate,
626,15,"Indira Gandhi G.H., Ichalkaranji, Dist. Kolhapur","16/992,Ichalkaranji,Main Road.Gokul Chouk,KOLHAPUR",416115.0,16.40594444,74.28052778,9552565849.0,200,Government,
627,19,Indira Gandhi Goverment Medical College and Genreral Hospital,"Central Avenu Near Railway Station?%27,%27HSP011211509%27)",440018.0,21.1513175,79.0991502,9156543001.0,574,Government,DMER
628,19,Indira Gandhi Hospital,"Indira Gandhi Hospital Co op Colony, Ambazari - 440010",440010.0,21.12566667,79.05777778,9226380480.0,88,Government,
629,22,"Indira Gandhi Rugnalaya, Panchvati","Panchavati,Nashik - 422001",422001.0,20.0082,73.80645,9922020306.0,50,Government,
630,1,Indira Hospital,"Indira Hospital,Jamkhed,on front Of Bus Stand,Khade Nagar,AHMADNAGAR??%27,%27HSI50072%27)",422605.0,19.612829,74.101239,8380807351.0,60,Corporate,
631,5,Indrakshi Eye Care,RAJIV GANDHI SQUARE BHANDARA,441904.0,21.1630556,79.6558056,9823834910.0,10,Corporate,
1,35,Indravati Hospital & Research Centre,"1,Rajashri Shahu Maharaj Marg,Behind NMMT Bus Depot,AIROLI-",400708.0,19.15,72.99,9867367836.0,50,Corporate,
632,25,Indrayani Hospital & Cancer Institute,"S.No. 217(2/3/4), Part 218,Alandi Devachi,Alandi Chakan Road,Opp warkari Shikshan sanstha,PUNE",412105.0,18.6856,73.9441,8805442020.0,0,Corporate,
633,22,"Indu Memorial Hospital, Behind District Court, Malegaon","70/3,SHREE SANKET EMPIRE,2ND FLOOR ,BEHIND DISTRICT COURT,MALEGAON.",423203.0,20.5533619,74.5080312,7411250201.0,45,Corporate,
634,34,Indudatta Multispeciality Hospital Pvt Ltd,"Umarkhed, Near Bus Stand, Nanded Road UmarkhedTiwarangkar Complex, 445206",445206.0,19.6008611,77.6906388,8308702727.0,20,Corporate,
635,35,Infigo Eye Care Hospital Bhayander,1001 First Floor C Wing Janaki Heritage Opp Maxus Mall Bhayander W Maharashtra 401101,401101.0,19.2982232,72.824575,9372717697.0,10,Corporate,
636,35,Infigo Eye Care Hospital Virar,,,19.295112535714285,73.01962990809524,,10,Corporate,
637,35,"Infigo Eyecare Hospital, Palghar",,,19.295112535714285,73.01962990809524,,10,Corporate,
638,9,Institute of Urology,"CTS no. 3554/A2, 3, 4,Moglai,Sakri road,DHULE",424001.0,20.9254213,74.7395367,9422788113.0,115,Corporate,
639,25,"Integrated Cancer Treatment & Research Centre , Wagholi","WAGHOLI,KESNAND ROAD, OPP. CITRON Pune?%27,%27HSI70425%27)",412207.0,18.5458332,74.20912,9820648058.0,50,Corporate,
640,4,International Hospital Aurangabad,,,19.944847311671925,75.41925964069401,,30,Corporate,
641,28,Isapure Orthopeadic Hospital,Lokmanya Tilak Nagar Miraj Sangli 416410,416410.0,17.0348056,74.6018333,9890025848.0,50,Corporate,
642,25,"Isha Eye Care Pvt Ltd,Pune City,Pune,Pvt","1ST FLOOR , A WING, PREMIER PLAZA, ANAND NAGAR, OLD MUMBAI -PUNE HIGHWAY, Pune- 411019",411019.0,18.6395,73.79586111,9004344116.0,10,Corporate,
643,35,Isha Eyecare Pvt Ltd Kalyan,"1ST FLOOR,RADHA KRISHNA SANKUL,OPPOSITE HOLY CROSS HOSPITAL,KALYAN WEST",400607.0,19.2376677,72.9777802,7738055143.0,20,Corporate,
644,35,Isha Eyecare Pvt Ltd Thane,"DOSTI IMPERIA, SHOP NO 2, NEAR R MALL, GHODBANDER, THANE WEST, Ghodbunder Service Rd, Bhavani Nagar, Thane West, Thane, Maharashtra 400607",400607.0,19.2376677,72.9777802,7738055143.0,20,Corporate,
645,4,"J J Plus Hospitals Pvt Ltd, Aurangabad",,,19.944847311671925,75.41925964069401,,45,Corporate,
646,25,J S HOSPITAL,"S.NO.52/12, NARHE,  NEAR NAVLE BRIDGE, Haveli, Pune-411041",411041.0,18.4508056,73.8119167,7798764393.0,32,Corporate,
647,7,JADHAO PULSE HOSPITAL AND CRITICAL CARE CENTER AND MATERNITY HOME,"SANGAM CHOWK, NEAR BUS STAND,CHOPDE LAY OUT, 443001",443001.0,20.5336389,76.1794722,9987602080.0,30,Corporate,
648,24,JADHAV MULTISPECIALITY HOSPITAL,"SAMARTH NAGAR, SHELGAON ROAD, SONPETH - 431516",431516.0,76.434814,19.25656,7972153026.0,11,Corporate,
649,31,"JAGTAP SUPERSPECIALITY HOSPITAL, KARKAMB","SHANKAR NAGAR, KARKAMB PANDHARPUR ROAD, Pandharpur, Solapur- 413302",413302.0,17.861163,75.347048,9503550739.0,30,Corporate,
650,7,JAI GJANAN CHILDREN AND EYE HOSPITAL SHEGAON,02 gajanan society balapur road shegaon  BALAPUR ROAD SHEGAON 444203,444203.0,20.85682,76.70099,9766860114.0,20,Corporate,
651,19,JAI SHRADDHA MULTISPECIALITY HOSPITAL AND RESEARCH CENTRE PRIVATE LIMITED,07000272 SAONER MAHESHWARI LAYOUT 441107,441107.0,21.305863,78.947739,8237578777.0,30,Corporate,
652,35,JAIN MULTISPECIALITY HOSPITAL,"C-WING, SHREE RAJ ENCLAVE CHSL, NEAR SEVEN SQUARE ACADEMY, Mira Road east %E2%80%93 C-WING, SHREE RAJ ENCLAVE CHSL, NEAR SEVEN SQUARE ACADEMY, Mira Road east %E2%80%93 401107",401107.0,19.1922325,73.0637706,9930811123.0,35,Corporate,
653,16,JAJU HOSPITAL,"DESHPANDE COLONY, AUSA ROAD, OPP VISHWAMITRA HOTEL - 413512",413512.0,19.968664,73.831608,9637820011.0,30,Corporate,
654,35,JAN SEVA MULTISPECIALITY HOSPITAL AND ICCU,DOMBIVALI EAST DAWADI ROAD 421203,421203.0,19.2148889,73.1058889,8691946249.0,16,Corporate,
655,23,JANAI MATERNITY HOSPITAL,"NEAR SUDHIR PATIL HOUSE,Dharashiv, DIC ROAD BARSHI NAKA, near sudhir patil house %E2%80%93 413501",413501.0,18.408779,76.559758,7709445561.0,30,Corporate,
656,28,JANKALYAN HOSPITAL PANDHARPUR,,,17.23956558827751,74.43125957272727,,60,Corporate,
657,22,JAY HARI Multispecicality Hospital,"Mulchand Bhai Gothi Complex, Above Bank of India, Ghoti Budruk, Tal-Igatpuri, Dist-Nashik 422402",422402.0,19.6973226,73.5609291,7303594175.0,30,Corporate,
658,22,JEEVAN HOSPITAL AND RESEARCH CENTER,"MANMAD CHOWFULI, CHANDAN PURI SHIVAR, MALEGAON, MANMAD CHOWFULA, 423212",423212.0,20.48665,74.6149,9960692340.0,50,Corporate,
659,35,JEEVAN JYOTI TRUST HOSPITAL,,,19.295112535714285,73.01962990809524,,39,Corporate,
660,29,JEEVANDHARA HOSPITAL SATARA,"523 A18 B SADAR BAZAR SATARA, KALYANI ESTATE SADAR BAZAAR, NEAR NEW DCC BANK %E2%80%93 415001",415001.0,17.6881944,74.0068333,7972168835.0,30,Corporate,
661,14,"JIIUs Indian Institute of Medical Science & Research Medical college Noor Hospital, Jalna","surve no 52 53 54 55 57,Aurangabad- Jalna Road at Warudi Tq. Badnapur, Dist. Jalna,Aurangabad",431202.0,19.91545,75.69791,9325212833.0,545,Corporate,
662,25,"JIJAMATA HOSPITAL, PIMPRI","TAPOVAN ROAD, NEAR DELUX CHOWK, PIMPRI, OPPOSITE JAI HIND SCHOOL, HAVELI, PUNE-411017",411017.0,18.56578105076228,73.89409255768733,9881161255.0,130,Government,
663,7,JIJAU HOSPITAL,"%C2%A0Mehkar Rd, Sindkhed Raja, Maharashtra 443203",443203.0,19.3669908,76.9671755,,30,Corporate,
664,16,JIVANSHREE HOSPITAL,"262, NEW RENAPUR NAKA LATUR, LATUR NANDED RING ROAD, BEHIND HOTEL SUYAS LOWGDE %E2%80%93 413512",413512.0,19.968664,73.831608,8805558569.0,10,Corporate,
665,36,JIVDANI HOSPITALS PVT. LTD. (ALLIANCE HOSPITAL),"Tulinj, Near Atma Vallabh Society,Nalasopare (E), Palghar-",401209.0,19.4253889,72.8274167,9326475226.0,45,Corporate,
