hospital_id,district_id,hospital_name,address,pincode,latitude,longitude,mco_contact_number,total_beds,hospital_type,government_subtype
618,35,ISHA EYECARE PVT LTD,"2ND FLLOR, PRABHAT PLAZA, NEAR WALFARE CENTRE,OPP. NAVARE ARCADE,SHIV MANDIR ROAD, - 421501",421501.0,19.20731206378402,73.18198412882596,8657953522.0,10,Corporate,
619,4,ISHWAR INSTUTUTE OF HEALTH CARE,,,19.94490366711477,75.41851338635013,,30,Corporate,
620,19,Icon Hospital,"Icon Hospital,K12, Amravati Road,Bharat Nagar,Amravati Road,kinkhede layout,NAGPUR",440033.0,21.15237938695835,79.06913168612105,8275044877.0,60,Corporate,
621,34,Icon Hospital Pusad,"3895,Pusad,New Doctor Line Pusad,NAIK SQUARE PUSAD,YAVATMAL",445204.0,19.909106250795663,77.57082559396211,9822363149.0,30,Corporate,
622,4,Ikon Multispeciality Hospital pvt Ltd,,,19.944236992655235,75.41924230155783,,30,Corporate,
623,19,Imamwada Isolation Hospital In Rambagh,Imamwada Isolation Hospital In Rambagh - 440003,440003.0,21.123734337123174,79.08479499808071,9325853351.0,40,Government,
624,25,"Indapur Criticare Center, Pune","A44,indapur,pune",413106.0,18.10202274405211,75.09558839217802,9156101414.0,50,Corporate,
625,25,"Indian Institute of Metabolic Sciences & Dr. Todkar Multispecialty Hospital (A Joint Venture of PMC and JT Foundation),Pune,PVT","Survey No. 33, Pan Card Club Road, Next to Malpani M-Agile, Pune-411045",411045.0,18.56883058551457,73.7662038523002,9823390505.0,150,Corporate,
626,15,"Indira Gandhi G.H., Ichalkaranji, Dist. Kolhapur","16/992,Ichalkaranji,Main Road.Gokul Chouk,KOLHAPUR",416115.0,16.405766072791135,74.27996317959771,9552565849.0,200,Government,
627,19,Indira Gandhi Goverment Medical College and Genreral Hospital,"Central Avenu Near Railway Station?%27,%27HSP011211509%27)",440018.0,21.1513175,79.0991502,9156543001.0,574,Government,DMER
628,19,Indira Gandhi Hospital,"Indira Gandhi Hospital Co op Colony, Ambazari - 440010",440010.0,21.126598712918263,79.05703904876312,9226380480.0,88,Government,
629,22,"Indira Gandhi Rugnalaya, Panchvati","Panchavati,Nashik - 422001",422001.0,20.00794367356913,73.80550167794443,9922020306.0,50,Government,
630,1,Indira Hospital,"Indira Hospital,Jamkhed,on front Of Bus Stand,Khade Nagar,AHMADNAGAR??%27,%27HSI50072%27)",422605.0,19.612272558983868,74.10179994227677,8380807351.0,60,Corporate,
631,5,Indrakshi Eye Care,RAJIV GANDHI SQUARE BHANDARA,441904.0,21.162457950464574,79.65496572680505,9823834910.0,10,Corporate,
1,35,Indravati Hospital & Research Centre,"1,Rajashri Shahu Maharaj Marg,Behind NMMT Bus Depot,AIROLI-",400708.0,19.14994890635969,72.98901993846947,9867367836.0,50,Corporate,
632,25,Indrayani Hospital & Cancer Institute,"S.No. 217(2/3/4), Part 218,Alandi Devachi,Alandi Chakan Road,Opp warkari Shikshan sanstha,PUNE",412105.0,18.68476953230885,73.94471525173913,8805442020.0,0,Corporate,
633,22,"Indu Memorial Hospital, Behind District Court, Malegaon","70/3,SHREE SANKET EMPIRE,2ND FLOOR ,BEHIND DISTRICT COURT,MALEGAON.",423203.0,20.55390484668972,74.50886147764082,7411250201.0,45,Corporate,
634,34,Indudatta Multispeciality Hospital Pvt Ltd,"Umarkhed, Near Bus Stand, Nanded Road UmarkhedTiwarangkar Complex, 445206",445206.0,19.60157013087182,77.69100515112648,8308702727.0,20,Corporate,
635,35,Infigo Eye Care Hospital Bhayander,1001 First Floor C Wing Janaki Heritage Opp Maxus Mall Bhayander W Maharashtra 401101,401101.0,19.2973278657146,72.82514069723597,9372717697.0,10,Corporate,
636,35,Infigo Eye Care Hospital Virar,,,19.295803557335965,73.02022807238679,,10,Corporate,
637,35,"Infigo Eyecare Hospital, Palghar",,,19.295129493784906,73.01909571177254,,10,Corporate,
638,9,Institute of Urology,"CTS no. 3554/A2, 3, 4,Moglai,Sakri road,DHULE",424001.0,20.926111959951378,74.73999102561949,9422788113.0,115,Corporate,
639,25,"Integrated Cancer Treatment & Research Centre , Wagholi","WAGHOLI,KESNAND ROAD, OPP. CITRON Pune?%27,%27HSI70425%27)",412207.0,18.54679472234878,74.20843138519551,9820648058.0,50,Corporate,
640,4,International Hospital Aurangabad,,,19.944298640838028,75.41868323699377,,30,Corporate,
641,28,Isapure Orthopeadic Hospital,Lokmanya Tilak Nagar Miraj Sangli 416410,416410.0,17.03539067953524,74.6012071145929,9890025848.0,50,Corporate,
642,25,"Isha Eye Care Pvt Ltd,Pune City,Pune,Pvt","1ST FLOOR , A WING, PREMIER PLAZA, ANAND NAGAR, OLD MUMBAI -PUNE HIGHWAY, Pune- 411019",411019.0,18.638633319659647,73.79685823161317,9004344116.0,10,Corporate,
643,35,Isha Eyecare Pvt Ltd Kalyan,"1ST FLOOR,RADHA KRISHNA SANKUL,OPPOSITE HOLY CROSS HOSPITAL,KALYAN WEST",400607.0,19.236717334422888,72.97845068812032,7738055143.0,20,Corporate,
644,35,Isha Eyecare Pvt Ltd Thane,"DOSTI IMPERIA, SHOP NO 2, NEAR R MALL, GHODBANDER, THANE WEST, Ghodbunder Service Rd, Bhavani Nagar, Thane West, Thane, Maharashtra 400607",400607.0,19.2373984336831,72.97846343091952,7738055143.0,20,Corporate,
645,4,"J J Plus Hospitals Pvt Ltd, Aurangabad",,,19.944956552654347,75.42006290315298,,45,Corporate,
646,25,J S HOSPITAL,"S.NO.52/12, NARHE,  NEAR NAVLE BRIDGE, Haveli, Pune-411041",411041.0,18.45165798597283,73.81093489636255,7798764393.0,32,Corporate,
647,7,JADHAO PULSE HOSPITAL AND CRITICAL CARE CENTER AND MATERNITY HOME,"SANGAM CHOWK, NEAR BUS STAND,CHOPDE LAY OUT, 443001",443001.0,20.532789724351986,76.17897291745915,9987602080.0,30,Corporate,
648,24,JADHAV MULTISPECIALITY HOSPITAL,"SAMARTH NAGAR, SHELGAON ROAD, SONPETH - 431516",431516.0,76.43515263083273,19.257336544393024,7972153026.0,11,Corporate,
649,31,"JAGTAP SUPERSPECIALITY HOSPITAL, KARKAMB","SHANKAR NAGAR, KARKAMB PANDHARPUR ROAD, Pandharpur, Solapur- 413302",413302.0,17.86108288390259,75.34726194623255,9503550739.0,30,Corporate,
650,7,JAI GJANAN CHILDREN AND EYE HOSPITAL SHEGAON,02 gajanan society balapur road shegaon  BALAPUR ROAD SHEGAON 444203,444203.0,20.856196999705592,76.70159993366777,9766860114.0,20,Corporate,
651,19,JAI SHRADDHA MULTISPECIALITY HOSPITAL AND RESEARCH CENTRE PRIVATE LIMITED,07000272 SAONER MAHESHWARI LAYOUT 441107,441107.0,21.306797656222702,78.94727619786583,8237578777.0,30,Corporate,
652,35,JAIN MULTISPECIALITY HOSPITAL,"C-WING, SHREE RAJ ENCLAVE CHSL, NEAR SEVEN SQUARE ACADEMY, Mira Road east %E2%80%93 C-WING, SHREE RAJ ENCLAVE CHSL, NEAR SEVEN SQUARE ACADEMY, Mira Road east %E2%80%93 401107",401107.0,19.1922221519032,73.06294283222101,9930811123.0,35,Corporate,
653,16,JAJU HOSPITAL,"DESHPANDE COLONY, AUSA ROAD, OPP VISHWAMITRA HOTEL - 413512",413512.0,19.968782273312925,73.83161356688369,9637820011.0,30,Corporate,
654,35,JAN SEVA MULTISPECIALITY HOSPITAL AND ICCU,DOMBIVALI EAST DAWADI ROAD 421203,421203.0,19.21417777296831,73.10577303242623,8691946249.0,16,Corporate,
655,23,JANAI MATERNITY HOSPITAL,"NEAR SUDHIR PATIL HOUSE,Dharashiv, DIC ROAD BARSHI NAKA, near sudhir patil house %E2%80%93 413501",413501.0,18.40844720930417,76.55980166175061,7709445561.0,30,Corporate,
656,28,JANKALYAN HOSPITAL PANDHARPUR,,,17.23973689694837,74.43027656388449,,60,Corporate,
657,22,JAY HARI Multispecicality Hospital,"Mulchand Bhai Gothi Complex, Above Bank of India, Ghoti Budruk, Tal-Igatpuri, Dist-Nashik 422402",422402.0,19.6978446119659,73.56135512858371,7303594175.0,30,Corporate,
658,22,JEEVAN HOSPITAL AND RESEARCH CENTER,"MANMAD CHOWFULI, CHANDAN PURI SHIVAR, MALEGAON, MANMAD CHOWFULA, 423212",423212.0,20.48665,74.6149,9960692340.0,50,Corporate,
659,35,JEEVAN JYOTI TRUST HOSPITAL,,,19.294845108486697,73.01873577996638,,39,Corporate,
660,29,JEEVANDHARA HOSPITAL SATARA,"523 A18 B SADAR BAZAR SATARA, KALYANI ESTATE SADAR BAZAAR, NEAR NEW DCC BANK %E2%80%93 415001",415001.0,17.688704265079572,74.00774365032095,7972168835.0,30,Corporate,
661,14,"JIIUs Indian Institute of Medical Science & Research Medical college Noor Hospital, Jalna","surve no 52 53 54 55 57,Aurangabad- Jalna Road at Warudi Tq. Badnapur, Dist. Jalna,Aurangabad",431202.0,19.914930303192044,75.69755704922747,9325212833.0,545,Corporate,
662,25,"JIJAMATA HOSPITAL, PIMPRI","TAPOVAN ROAD, NEAR DELUX CHOWK, PIMPRI, OPPOSITE JAI HIND SCHOOL, HAVELI, PUNE-411017",411017.0,18.56514867654124,73.89424642993401,9881161255.0,130,Government,
663,7,JIJAU HOSPITAL,"%C2%A0Mehkar Rd, Sindkhed Raja, Maharashtra 443203",443203.0,19.366300482789296,76.96688788788691,,30,Corporate,
664,16,JIVANSHREE HOSPITAL,"262, NEW RENAPUR NAKA LATUR, LATUR NANDED RING ROAD, BEHIND HOTEL SUYAS LOWGDE %E2%80%93 413512",413512.0,19.96905802602787,73.83172823196603,8805558569.0,10,Corporate,
665,36,JIVDANI HOSPITALS PVT. LTD. (ALLIANCE HOSPITAL),"Tulinj, Near Atma Vallabh Society,Nalasopare (E), Palghar-",401209.0,19.425161825128654,72.82725719920361,9326475226.0,45,Corporate,
666,9,JMFS ACPM medical college,"SAKRI ROAD DHULE,morane,DHULE",424001.0,20.925545521765248,74.73854842945578,9822190303.0,616,Corporate,
667,21,JOSHI HOSPITAL,"Plot no 88/89 JOSHI HOSPITAL, Rupaseth Park, TALODA ROAD %E2%80%93 425412",425412.0,21.311357019736903,74.21961251613553,7498291147.0,20,Corporate,
668,15,JOSHI HOSPITAL & DIALYSIS CENTRE,"23,Datta Colony,Old Pune Benglore Highway,Tararani Chowk,KOLHAPUR",416003.0,16.430239087978183,74.14185804719243,9822042785.0,20,Corporate,
669,13,JPC BANK RAMDAS PATIL SMURTI SEVA TRUST RAJE SHREE CHATRAPATI SHAHU MAHARAJ HOSPITAL,"KWAJAMIYA ROAD SHAHU NAGAR,OPP ICICI BANK ,JALGAON",425001.0,20.465120076328216,75.00372236720861,9422209608.0,50,Corporate,
670,17,JSO AND JAGAR MEDICAL CENTRE(SNEHA MANAV FOUNDATION),,,18.95794063199693,72.8322374919345,,5,Corporate,
671,26,JSW Sanjeevani Multi Specialty Hospital,"Wadkal Dharamtar road,Near Dharamtar Police Check Post,Wave,RAIGAD",402107.0,18.74077321793928,73.11258411117451,9819645863.0,100,Corporate,
672,15,JYOTIRLING DHARMADAY RUGNALAY AND RESEARCH CENTRE,"87, Ajara Road, Nesari, Gadhinglaj, Kolhapur-416504",416504.0,16.606779525443592,74.30293559825856,9767745842.0,300,Corporate,
673,31,"Jagdale Mama Hospital,Barshi",,,19.01984775587661,74.21087077448495,,300,Corporate,
674,17,Jagjivanram railway Hospital,,,18.95814105112179,72.8311979459035,,361,Government,
675,21,Jai Shree Datta Accident Hospital,"1,Dongargoan Chaufully,Dongargoan Road,",425409.0,21.54497322427869,74.46890732721506,9730003875.0,10,Corporate,
676,29,Jai bhagwan Hospital,"SATARA - pandharpur road mhaswad,SATARA pandharpur road,",415508.0,17.824286917666097,74.54674232448326,9763464373.0,30,Corporate,
677,25,Jaihind Super Speciality Hospital,"7 and 8, Pune Nashik Highway Near Hotel Haveli, Bhosari, Sadgurunagar, Haveli, Pune- 411039",411039.0,18.62010136814793,73.84893101902665,8999081084.0,51,Corporate,
678,13,"Jalgaon Cancer Care and Radiation Centre, Jalgaon","Bunker Unit No. BU 01, Lower Basement Floor of Nayantara Arcade- City Pride, CS No. 2125/19 & 20, Govinda Chawk, Near Railway Station, Pimprala Road 425001",425001.0,20.46477799803481,75.00372563079436,8380007270.0,10,Corporate,
679,14,Jalna Hospital,"JALNA HOSPITAL,JALNA,AMBAD SQUARE ,JALNA",431203.0,19.839235003680425,75.8895039964433,9552519051.0,80,Corporate,
680,14,Jalna Mission Hospital,"SURVEY NO 2930 DURGA MATA ROAD?%27,%27HSI131167%27)",431203.0,19.84084151290211,75.8901631776757,9822063949.0,0,Corporate,
681,15,Janai Multispeciality Hospital & Research Center,"MARKET YARD SANKESHWAR ROAD, GADHINGLAJ, KOLHAPUR-416502",416502.0,16.606367359364857,74.30395514593623,9595353549.0,45,Corporate,
682,15,"Janaki Multispecialty Hospital, Kolhapur","2018/E, RAJARAMPURI, 3RD LANE,  BUS Rout, Kolhapur-",416008.0,16.689315386531494,74.24908643404063,9422412513.0,40,Corporate,
683,35,Janki Global Multispeciality Hospital,Chaitanya Palace first floor near anmol garden 100 feet road beside Sai Marriage Hall 421306,421306.0,19.4131815724986,73.36420849580554,9594658153.0,40,Corporate,
684,36,Janseva Hospital,"1st Floor, Dattani Prism-1, behind dattani square mall, papdy,?%20Vasai%20West,%20Maharashtra?%27,%27HSI58745%27)",401205.0,19.721463378075747,72.7480039709017,9172218124.0,60,Corporate,
685,22,Janseva Hospital,"Janseva Hospital, 1,6,7?%20367/387,runwal%20nagar,ugon%20road,NASHIK%27,%27HSI40951%27)",422303.0,20.03742314043614,74.09911670424336,9822425015.0,50,Corporate,
686,25,Janseva foundation govindrao dhapre rural hospital,"Ambi Ranwadi,  Panshet ROAD, Velhe, Pune-412107",412107.0,18.2962729,73.637428,9823011760.0,100,Corporate,
687,13,Jawale Hospital,"2,Near SBI,Jilha peth,Gandhi nagar,Jalgaon,Shree Chitre Marg,JALGAON",425001.0,20.46501908233772,75.00470919117316,9370000380.0,15,Corporate,
688,31,"Jayashree Multispecility Hospital Icu & Accident Care,Madha,Solapur,Pvt","104/1/A, Bemble Rod , Near Shivtej Kirana store, TEMBHURNI, MADHA, Solapur-413211",413211.0,17.984224624885815,75.29947368149662,8830170570.0,30,Corporate,
689,4,Jeevan Amrut Hospital,,,19.94405100620221,75.4197166285617,,30,Corporate,
690,13,Jeevan Jyoti Cancer Hospital,"47, Vivekanand Nagar, Jilha peth,%C2%BF%C2%BFNear Ambedkar Market, Jalgaon",425001.0,20.46367933947608,75.00392354184102,8380007270.0,5,Corporate,
691,4,Jeevandayee Multi Speciality Hospital,,,19.944850710003937,75.41971057703091,,35,Corporate,
692,25,"Jeevanjyoti Hospital, Pune","14, kokane chouk rahatani, haveli, Pune-411017",411017.0,18.5650075132088,73.89390529049788,8237026263.0,110,Corporate,
693,33,Jijau Orthocare Hospital Washim,"Shop No 1 , Leela Suzuki Charkha Complex , Akola Naka , Washim-444505",444505.0,20.169970145818287,77.17008165412794,8080499820.0,30,Corporate,
694,4,Jilla Hospital,,,19.94548403295472,75.4186029970841,,50,Corporate,
695,35,Jupiter Hospital,"Near Cadbury Junction,Eastern Express Highway,Next to Viviana Mall,Thane",400601.0,19.19992126290365,72.97971905685539,9869022833.0,350,Corporate,
696,25,"Jupiter Lifeline Hospitals Ltd,Haveli,Pune,Pvt","Lane 3, Baner - Balewadi Rd, Prathamesh Park, Baner, Pune, Maharashtra-411045",411045.0,18.5687347416284,73.7670050557408,8805238632.0,400,Corporate,
697,28,Jyotirmayee Hopsital,49 Datta Nagar Near Datta Tekadi Kameri Road Islampur Sangli 415409,415409.0,17.019824035477903,74.27927679517194,9356377565.0,20,Corporate,
698,15,"K STAR MULTISPECIALITY HOSPITAL PVT LTD,Pvt,Kolhapur","762, 6A, NEAR ITI COLLEGE, JAMSANDEKAR NAGAR, SAMBHAJI NAGAR, KARVIR, KOLHAPUR-416007",416007.0,16.66119444,74.20908333,9860934455.0,45,Corporate,
699,18,K.B Bhabha Hospital Bandra (W),,,19.11911483881386,72.87398623128003,,436,Government,MCGM
700,18,K.B Bhabha Hospital Kurla (W),,,19.119062057934418,72.8736128842287,,306,Government,MCGM
701,17,K.J.Somaiya Hospital & Research Centre,,,18.95901338227749,72.83227438885996,,500,Corporate,
702,29,K.N.Gujar Memorial hospital,"OPPOSITE S.T.STAND KARAD,KARAD,SATARA",415110.0,17.687365204968582,74.0067329079814,9763999704.0,100,Corporate,
703,28,"KABADE SURGICAL HOSPITAL,Pvt,Sangli,","Opp.Karmaveer Bhaurao Patil Nagari Sah, Pat Sansth, Sangli-Kolhapur Road, Sangli- 416416",416416.0,17.035318312109485,74.60242156912346,9822052682.0,50,Corporate,
704,4,KABRA HOSPITAL,,,19.94483650577745,75.42004913583567,,30,Corporate,
705,34,KADU HOSPITAL,"NEAR STATE BANK OF INDIA ,AKHADA ROAD,YAVATMAL?%27,%27HSI69015%27)",445302.0,20.02272973687439,78.54576559739448,8275110035.0,20,Corporate,
706,3,KADU ORTHOCARE HOSPITAL,"PARATWADA, CIVIL LINE %E2%80%93 444805",444805.0,20.53721389382114,76.18193141343293,7223221095.0,10,Corporate,
707,15,"KAI. GUNDU PATIL CHARITABLE TRUST SANCHALIT SANGOPAN HOSPITAL AND RESEARCH CENTER,NAREWADI,Gadhinglaj,Kolhapur,PVT","603,Gadhinglaj, Kolhapur,Narewadi Halkarni Road,Narewadi Halkarni Road",416506.0,16.60667182448502,74.30448031983109,8208443377.0,40,Corporate,
708,35,KAIZEN SUPER SPECIALTY HOSPITAL,"Ranka Chambers ,Ramchandra Nagar , Nitin Company Junction,Eastern Express Highway, Thane west - 400604",400604.0,19.18523314653391,72.95850778995242,9372304908.0,50,Corporate,
709,33,KAKADE CARE AND CRITICAL HOSPITAL,"GULATI LAY OUT, HINGOLI ROAD WASHIM-444505",444505.0,20.169641239813103,77.16935666302486,9604433212.0,30,Corporate,
710,6,KAKU NANA MEMORIAL HOSPITAL,"NAVGAN PLAZA,AURANGABAD ROAD,OPP HOTEL SAI PALACE, BEED-431122",431122.0,19.838606739672684,75.89028293701602,8149049049.0,70,Corporate,
711,20,KALAWATI HOSPITAL,OPPOSITE KHURANA TRAVELS NEAR UNDERBRIDGE HINGOLI GATE CHOWK NANDED hoseno33873 %E2%80%93 431601,431601.0,20.55393338400921,74.51166513517202,9823299066.0,30,Corporate,
712,35,KALPADEEP HOSPITAL,,,19.294382492686427,73.01922226162635,,45,Corporate,
713,13,KALPANA HOSPITAL,"1,1565,NH6,BESIDE ERANDOL POLICE STTION,JALGAON",425109.0,20.917694567629084,75.3318337074162,7020328595.0,35,Corporate,
714,35,KALPATARU MULTISPECIALITY HOSPITAL,2nd 3rd Floor  KALYAN  STATION ROAD  BAIL BAZAR CHOWK  421301,421301.0,19.53499343752247,76.14539290425772,9405680978.0,100,Corporate,
715,28,"KAMAL ORTHOPEDIC CENTRE, JATH MULTISPECIALTY HOSPITAL","523, SATARA ROAD , JATH",416404.0,17.130787019942787,75.2205135784458,9822338014.0,30,Corporate,
716,15,"KAMATE MULTISPECIALITY HOSPITAL AND RESEARCH CENTER,KOLHAPUR,PVT","CHURCH ROAD GADHINGLAJ,CHURCH ROAD,GADHINGLAJ",416502.0,16.605964400351603,74.30425124307253,8180025339.0,30,Corporate,
717,1,KANAWADE HOSPITAL,"Plot No. 72, RAJAPUR ROAD, Sangamner %E2%80%93 422605",422605.0,19.61213296036495,74.10049963597619,9112377888.0,35,Corporate,
718,6,KARAD HOSPITAL,PARLI VAIJNATH NEAR BUS STAND,431515.0,18.73131025407407,76.63250040473808,9422240866.0,50,Corporate,
719,32,KATARIYA HOSPITAL,"NEAR MAHAVIR BHAVAN, GURUNANAK WARD, COURT ROAD, MAHAVIR BHAWAN, 442301",442301.0,20.553943696494485,78.83530950681781,9422844943.0,24,Corporate,
720,1,KATE MULTISPECIALITY HOSPITAL,"21- DHOLEWADI, AKOLA SANGAMNER ROAD, BEHIND GRAPS HOTEL- 412605",412605.0,19.264698112278243,74.63829380222622,9860009965.0,50,Corporate,
721,7,KATKAR MULTISPECIALITY HOSPITAL AND TRAUMA CARE CENTRE,"49, BEHIND BUS STAND, MAHATMA PHULE SCHOOL, 443001",443001.0,20.53390646656949,76.17897860232675,7276855281.0,35,Corporate,
722,20,KATRUWAR ACCIDENT AND MATERNITY HOSPITAL,DOCTOR LANE NANDED   431601,431601.0,20.554541591650658,74.51207915924485,9422172320.0,20,Corporate,
723,35,KDMC Dialysis Center Tisgoan,"Vegetable Market, Near Yashwant Chhatra Bunglow, Vijaynagar Amrai,Kalyan ?%27,%27HSI86878%27)",421306.0,19.41344587195688,73.36444137510884,9867424007.0,10,Government,
724,35,"KDMC, Dialysis Center Thakurli East","KDMC Health Center, near Vegetable Market, Thakurli, Chole Gaon, Dombivli, Maharashtra 421201",421201.0,19.21742880597439,73.08291873712416,9820657744.0,10,Government,
725,17,"KEM Hospital, Parel",,,18.95858791243076,72.83113189841555,,2288,Government,MCGM
726,9,"KESHARANAND MULTISPECIALITY HOSPITAL, ?DHULE","220/A, 6,STATION ROAD,RAILWAY STATION,DHULE",424001.0,20.925166614259787,74.73924011963592,8551894444.0,50,Corporate,
727,6,KESONA ACCIDENT HOSPITAL,SKH MEDICAL COLLEGE CAMPUS VIDYANAGAR WEST KSK COLLEGE ROAD BEED 431122,431122.0,19.839214968857164,75.88959247252355,9158915555.0,20,Corporate,
728,13,KHADKE HOSPITAL AND HEALTHCARE PVT LTD,"470/29,M J COLLEGE ROAD ,BHASKAR MARKET JALGAON",425001.0,20.46486026274745,75.00361656160354,9373385980.0,30,Corporate,
729,33,KHANDESHWAR HOSPITAL,AT DHANORA TQ MANGRULPIR DIST WASHIM - 444105,444105.0,20.57035407562977,77.60060642424648,9420106141.0,25,Corporate,
730,13,KHELWADE CHILDRENS HOSPITAL,1 JALGAON PRATAP NAGAR OPP. SWAMI SAMARTH TEMPLE 425001,425001.0,20.46440375391248,75.00466276641345,8055369800.0,30,Corporate,
731,3,KHERDE BALRUGNALAY,"APPROACH?%20ROAD,ABOVE?%20KHAMGAON?%20BANK,WARUD%27,%27HSI78568%27)",444906.0,21.38032372062443,78.25971105959431,9049661205.0,20,Corporate,
732,29,KIRAN HOSPITAL DAHIVADI,NEAR ST STAND DAHIWADI MAN  SATARA %C2%BF 415508,415508.0,17.82499671707807,74.54672840273977,8446563040.0,30,Corporate,
733,15,KLES DR PRABHAKAR KORE HOSPITAL & MRC,"NEHRU NAGAR,NEAR KEB,BELGAUM,KOLHAPUR",590010.0,15.91,74.52,9481739597.0,2000,Corporate,
734,29,KMRFs NIKOP HOSPITAL,"9,10 , Ring Road, Nikop - 415523",415523.0,17.984600125835502,74.43652619547828,9822037374.0,102,Corporate,
735,2,"KOKILABEN DHIRUBHAI AMBANI HOSPITAL, CANCER CENTER ( UNIT OF MALTI VASANT HEART TRUST)","01 Infield Gut No 91/1 91/2,Ridhora,NH6 Balapur Road,Balapur,AKOLA",444302.0,20.65,76.91,9769875849.0,10,Corporate,
736,11,"KOKILABEN DHIRUBHAI AMBANI HOSPITAL, CANCER CENTER ,GONDIA","01 Infield Gut No 160/1 160/2,Village Dawwa Taluka Goregaon,Goregaon Road,Near HP Petrol Pump,GONDIYA",441801.0,21.299111911819622,80.30698853521524,9769875849.0,10,Corporate,
737,29,"KOLEKAR HOSPITAL , KARAD","422-B,SHANIWAR PETH,BEHIND ICICI BANK,SATARA",415110.0,17.688113092020345,74.00746922698869,9225211777.0,51,Corporate,
738,18,KOSMOPOLITAN CHARITABLE DIALYSIS AND DAY CARECENTER,,,19.119643151859623,72.87402705349237,,11,Corporate,
739,7,KOTHARI HOSPITAL CHIKHALI,"Main Road Chikhali,Opp ZP ground,BULDHANA",443201.0,20.230047932410645,76.24075254724448,8308842834.0,30,Corporate,
740,15,KPC multispecialty hospital PVT LTD,"1971,C Ward,Maharana Pratap Chowk,KOLHAPUR,",416002.0,16.605497492650194,74.30322651589258,9833550644.0,47,Corporate,
741,13,KRISHNA CHILDRENS HOSPITAL AND CRITICAL CARE CENTRE,TP NO 168/5B GANESH COLONY DHULE ROAD NEAR OSWAL ENT HOSPITAL 425401,425401.0,21.043291800012504,75.06211148892382,8626028873.0,15,Corporate,
742,13,KRISHNA CHILDRENS NICU HOSPITAL,"Krushna kunj near pandurang takiles jamner road Bhusawal, Jamner road,425201",425201.0,20.76205545988593,74.84566945520736,8007722277.0,25,Corporate,
743,16,KRISHNA HOSPITAL,"SHYAM NAGAR LATUR 413512?%27,%27HSI29538%27)",413512.0,19.967842679804583,73.8314835629546,9823028566.0,30,Corporate,
744,15,KRISHNA HOSPITAL,"PLOT NO.5, R.S.NO.740/2, A WARD, SAMBHAJI NAGAR, KOLHAPUR-416012",416012.0,16.412405909180414,74.13030461291,9822255275.0,33,Corporate,
745,19,KRISHNA MULTISPECIALITY HOSPITAL & NURSING HOME,"MAIN ROAD,OPP.KRISHI MANDI,Saoner , Nagpur %E2%80%93 441107",441107.0,21.306407535113674,78.94689005417204,9225217784.0,50,Corporate,
746,29,KRUSHNAI ICU MULTISPECIALITY HOSPITAL,"8 & 9,VADUJ,DAHIWADI ROAD,SATARA",415506.0,17.81567446243496,74.08933913817164,8080795381.0,30,Corporate,
747,20,KSHITIJ MULTISPECIALITY HOSPITAL,"Plot No. 34, SHIVAJI NAGAR, WADIA FACTORY AREA, - 431601",431601.0,20.554623127862204,74.51120330446247,9960053317.0,35,Corporate,
748,6,KUSUM HOSPITAL ORTHOPEDIC TRAUMA CARE CENTER,DP ROAD   Adarsh Nagar Beed   Beed  431122,431122.0,19.838802718156717,75.88962640183803,9527795766.0,20,Corporate,
749,1,KUTE HOSPITAL AND LAPROSCOPY CENTRE,"149,SANGAMNER,40 FEET DP ROAD,TAJANE MALA,Ahmadnagar",422605.0,19.613752087445764,74.10185352329866,9922140353.0,35,Corporate,
750,9,KVTRCOLLEGE AND LILAI HOSPITAL BORADI,"KVTR COLLEGE, LILAI HOSPITAL, TAL SHIRPUR,DIST DHULE BORADI , - 425428",425428.0,20.9292,73.991,9422815205.0,100,Corporate,
751,34,Kadam multispeciality Hospital And Diagnostic Centre,"Pusad , Opp Tv Centre , 445204",445204.0,19.90878036550871,77.57125270509664,9422166043.0,40,Corporate,
752,22,"Kai Vithalrao Govind kele Camp ( Modular Cantener) hospital, Malegaon","Malegaon Camp,Nashik - 423105",423105.0,20.550809810210502,74.52843319319146,9823284759.0,100,Government,
753,20,Kakandikar Multispeciality Hospital,Hingoli Gate Nanded %E2%80%93 431602,431602.0,19.199321968863373,77.40012632877692,9130481458.0,50,Corporate,
754,14,Kalawati Superspeciality Hospital,"Plot No. 1 rishipark Ambad Chaufully , Jalna - 431203",431203.0,19.84088754824069,75.889007660581,9890468658.0,80,Corporate,
755,35,Kalyan Cancer Centre,"VILLAGE BAPGAON,KALYAN-PADGHA ROAD,BAPGAON,",421302.0,19.20985134968651,73.04730279528083,9225123445.0,20,Corporate,
756,31,"Kalyanraoji Bhatlawande Balrugnalaya ICU Centre,BARSHI","651/2/1/19+20,Chatrpati Colony,Kurduwadi Road,Near Dr.Deshpande Hospital,SOLAPUR",413411.0,17.514508871933717,75.44589318690328,9763983635.0,35,Corporate,
757,13,Kamal Hospital & Maternity Home JAMNER,"85,Shivaji Nagar,Jalgaon Road,Market Committee,JALGAON",424206.0,20.76148177626087,74.84656292850023,9423188285.0,30,Corporate,
758,31,"Kamal Medicare Cancer And Superspeciality Centre,Solapur North,Solapur,Pvt","S. No. 153-4-A-1, Hissa No. 2, GANDHI NAGAR, AKKALKOT ROAD, SOLAPUR NORTH, SOLAPUR-413005",413005.0,17.68164861963539,75.92829472851336,7840924365.0,35,Corporate,
759,28,"Kamala Accident & Orthopedic Hospital, Palus","2420,near new st stand, Palus, Tal--palus, near bharat gas, ,vidyanagar, palus",416310.0,17.130358343399074,74.47914814981442,9890394929.0,30,Corporate,
760,25,Kamla Nehru Hospital Pune,"2nd floor,Kamla Neharu Hospital,Mangalwar peth,PUNE?%27,%27HSI54627%27)",411011.0,18.521235664263365,73.85973248847355,9970735430.0,350,Government,
761,33,Kanade Bal Rugnalaya,"Hingoli Road,Washim",444505.0,20.169574805067693,77.17011575836716,9850383497.0,35,Corporate,
762,13,Kantai Netralaya ( A unit of Bhavarlal & Kantabai Jain Multipurpose foundation ),"17,NIMKHEDI ROAD,OLD JAIN PIPE,JALGAON",425001.0,20.46388861518364,75.00335391501424,7276007707.0,30,Corporate,
763,22,Karuna Hospital Manmad,"174/1,174/2,manmad,yeola road,NASHIK",423104.0,20.32896185668616,74.24368716670584,9881562284.0,80,Corporate,
764,32,Kasturba Hospital,"Sewagram-wardha Road  Sewagram Road, Wardha?%27,%27HSI1130%27)",442102.0,20.72845,78.71,8275094721.0,972,Government,
765,35,"Kaulcity Hospital and Dialysis Unit, Vasai West",,,19.29578626255874,73.0197745384665,,45,Government,
766,24,"Kaushalya Kidney Care And Superspeciality Hospital,Parbhani,Pvt","Beside Somani colour home, New doctor lane, Parbhani-431401",431401.0,19.27056541459789,76.7736876932913,8766616709.0,20,Corporate,
767,22,Kekan Hospital,"Lokmanya Nagar,Gangapur Road %E2%80%93 422002",422002.0,20.00461091012952,73.83606949892047,7058377939.0,15,Corporate,
768,28,"Khambalkar Super Speciality Hospital,Sangli,Pvt","MPSC BANK, PALUS ROAD, SAWANTPUR VASAHAT, SANGLI- 416308",416308.0,17.1,17.1,8803363738.0,30,Corporate,
769,16,Khandade Superspeciality Hoapital,"Opposite Old collector office, sambhaji Nagar, old railway line, Shivaji Chowk, Latur %E2%80%93 413512",413512.0,19.96799212717653,73.83117837319202,7972645216.0,15,Corporate,
