hospital_id,district_id,hospital_name,address,pincode,latitude,longitude,mco_contact_number,total_beds,hospital_type,government_subtype
1621,16,SAI HOSPITAL,VITHAL NAGAR SHELHAL ROAD 413517,413517.0,18.371473715922395,77.13472791744528,7972263916.0,0,Corporate,
1622,29,"SAI HOSPITAL,KARAD","OPP HOTEL SANGAM,KOLHAPUR NAKA,KARAD, PUNE BANGLORE HIGHWAY,KARAD %E2%80%93 415110",415110.0,17.687998989356153,74.00739988018488,9765787700.0,21,Corporate,
1623,25,"SAI MATERNITY AND GENERAL HOSPITAL, SHIKRAPUR","NEAR SHREE SWAMI SAMARTH TEMPLE, TALEGOAN DHAMDHERE ROAD, SHIKRAPUR, SHIRUR, PUNE-412208",412208.0,18.658175569615963,74.13690331174568,9156630909.0,35,Corporate,
1624,33,SAI MULTISPECIALITY HOSPITAL,INFRONT OF GRAMIN POLICE STATION AKOLA NAKA WASHIM- 444505,444505.0,20.16984126047376,77.16996188321617,8806233233.0,60,Corporate,
1625,28,SAI MULTISPECIALITY HOSPITAL AND CCU,MALI PLOT NO 46 VIJAPUR ROAD JATH SANGLI 416404,416404.0,17.12975262363391,75.21972637824743,7756944471.0,35,Corporate,
1626,22,SAI SAHYADRI MULTISPECIALITY HOSPITAL,"Panjara Poll Shoping Complex,Shree Chatrpati Shiwaji Maharaj Putala,Malegaon?%27,%27HSI88732%27)",423203.0,20.552466437335124,74.50840227724113,9422963357.0,50,Corporate,
1627,35,SAI SANJEEVANI MULTISPCIALITY HOSPITAL,"GARGI COMPLEX 2nd FLOOR KHARDI, KHARDI NAKA,  - 421601",421601.0,19.50997242883424,73.3463395876053,9890352782.0,35,Corporate,
1628,1,SAI SAWALI MULTISPECIALITY HOSPITAL,"Plot No. 1583, TAKALI DHOKESHWAR, NAGAR KALYAN HIGHWAY-414304",414304.0,19.150632067004604,74.3806051214963,7020448374.0,30,Corporate,
1629,22,SAI SHREE SUPER SPECIALITY HOSPITAL AND RESEARCH CENTRE,"1985.R. K. PLAZA,MUMBAI-AGRA HIGHWAY,SAIKHEDA PHATA,NASHIK",422206.0,20.07850278325618,74.10445650132229,9850889050.0,50,Corporate,
1630,25,SAI SNEH HOSPITAL AND DIAGNOSTIC CENTRE PVT LTD,"PUNE SATARA HIGHWAY NEAR PMT BUS STAND KATRAJ, PUNE-411046",411046.0,18.449677,73.85083,9822036736.0,30,Corporate,
1631,35,SAI SNEHDEEP HOSPITAL,"KOPAR KHAIRANE, INDIAN OIL PEROL PUMP ROAD - 400709",400709.0,19.103776185451597,73.00399300427155,8080072069.0,80,Corporate,
1632,1,SAI SUMAN HRUDAYALAYA & CRITICAL CARE,"NEW NAGAR ROAD SANGAMNER Ahmednagar , 422605",422605.0,19.61230101586065,74.10170002930806,9096165752.0,50,Corporate,
1633,1,SAIDEEP HEALTHCARE AND RESEARCH PVT LTD,"104/A1+104/1/2 PLOT NO 1+1,VIRAJ ESTATE,BEHIND YASHWANT COLONY,NAGAR MANMAD ROAD,TARAKPUR,Ahmadnagar",414001.0,19.161858450479443,77.30524513694206,9823133127.0,260,Corporate,
1634,34,SAIKRUPA MULTISPECIALITY HOSPITAL YAVATMAL,"Mahabali Nagar, Arni Road ,445001",445001.0,20.412124676348046,78.13308358637295,9404141861.0,30,Corporate,
1635,22,SAIMEVA ACCIDENT& MULTISPECIALITY HOSPITAL,"GHOTI TOLL PLAZA , NEAR KINARA HOTEL, GHOTI -422402",422402.0,19.69646058001742,73.56192070473556,9322250600.0,35,Corporate,
1636,35,SAINIT HOSPITAL,,,19.294690155654195,73.01892844412058,,40,Corporate,
1637,34,SAISHRADHA MULTISPCIALITY HOSPITAL and RESEARCH INSTITUTE,"Arni Naka, opposite Satya Sai jyot Mangal Karyalay,Sindhi colony Road, Yavatmal. Pin code 445001",445001.0,20.41259309251599,78.13464995114307,9527021383.0,30,Corporate,
1638,4,SAKOLKAR HOSPITAL AND SONOGRAPHY CENTER,,,19.94488763211797,75.41898927688662,,45,Corporate,
1639,15,SALAGARE CHILDREN AND EYE HOSPITAL,100 2 CHIKODI K CROAD MIRJE PETROL BUNK 591201,591201.0,16.425481482915817,74.58273498054109,9448472550.0,50,Corporate,
1640,16,SALUNKE CRITICAL CARE HOSPITAL,"front of the bus station,Nilanga",413521.0,18.12832271713992,76.7497423650451,9595958890.0,36,Corporate,
1641,9,"SAMARTH CANCER,LAPAROSCOPY & MATERNITY HOSPTAL","4 & 5, NAGAI COLONY, NEAR SAVARKAR STATUE, DEOPUR, DHULE-424002",424002.0,20.90398269364782,74.77452426871204,9881261177.0,30,Corporate,
1642,29,SAMARTH CHARITABLE AND MULTISPICIALITY HOSPITAL,"AM/1/1,MIDC,DEGAON ROAD, SATARA %E2%80%93 415004",415004.0,17.287506,74.157495,9049233233.0,30,Corporate,
1643,13,SAMARTH HOSPITAL,"BHAKTI PARK, SHIVAJI NAGAR, BEHIND PANDE BHOJNALAY JAMNER, 424206",424206.0,20.761696009747865,74.845418406263,9158044333.0,30,Corporate,
1644,1,"SAMARTH MULTISPECIALITY HOSPITAL, Ahmadnagar","Vishwakranti chauk Beed Road, JAMKHED, BEED ROAD - 413201",413201.0,18.720154399492845,75.30913178433006,9545403100.0,30,Corporate,
1645,22,SAMRUDDHI HOSPITAL,"H.N.307/0450/001, SHREE SWAMI SAMARTH NAGAR, NEAR NANDUR NAKA 422003",422003.0,20.079498578313395,74.10963081054322,8208635223.0,35,Corporate,
1646,13,SAMVEDNA SPECIALITY HOSPITAL (KM HEALTHCARE PRIVATE LIMITED),"CTS.NO.2688/15, PLOT NO.14, AKASHWANI SINDHI COLONY ROAD, Jalgaon 425001",425001.0,20.46515389850781,75.00393550397143,9403690077.0,40,Corporate,
1647,6,SANAP BAL RUGNALAYA,"D P ROAD,RAJIV GANDHI CHAWK,BEED",431122.0,19.8394561482424,75.88995717444483,8149981981.0,30,Corporate,
1648,7,"SANCHETI HRUDAYALAY, BULDHANA","15,NEAR SUNDERKHED GRAMPANCHAYAT,CHIKHLI ROAD,BEHIND GODE RESIDENCE,BULDHANA",443001.0,20.532892967151945,76.17858927320016,9822469930.0,50,Corporate,
1649,3,SANGOLE SUPERSPECIALITY NETRALAY,BRAMHIN SABHA COLONY JAISTAMBH CHOWK PARATWADA 444805,444805.0,20.536027526997085,76.18045422205358,7588300908.0,5,Corporate,
1650,12,SANJEEVANI CHILDRENS HOSPITAL,"NTC, BEHIND ASHA CYCLE STORE, HINGOLI- 431513",431513.0,77.14694802089603,19.79960151861677,9823039738.0,30,Corporate,
1651,6,SANJEEVANI HOSPITAL,BY PASS ROAD AMOL SARODE BUILDING MAJALGAON %E2%80%93 Beed %E2%80%93 431131,431131.0,19.20131367614189,76.34575462025148,8196977433.0,40,Corporate,
1652,28,SANJEEVANI HOSPITAL,"DATTA VASAHAT, ASHTA VADGAON ROAD ASHTA, WALWA, SANGLI-416301",416301.0,16.949758922761188,74.43001309999983,8855920979.0,20,Corporate,
1653,6,SANJEEVANI HOSPITAL AND CRITICAL CARE,"MEENATAI THAKRE CHOWK, CHANDRALOK BUILDING - 431715",431715.0,19.200125660474427,77.39962673538892,9405826905.0,35,Corporate,
1654,25,SANJEEVANI HOSPITAL ICU AND TRAUMA UNIT,"chakan talegaon road, Pune- 410501",410501.0,18.707077217720368,73.97759280369867,9823982330.0,50,Corporate,
1655,25,"SANJEEVANI MEDICAL FOUNDATION, LONAVALA","NEAR LONAVALA CITY POLICE STATION TAL MAVAL,PANDIT NEHRU ROAD",410401.0,18.619355,73.36995,9890023940.0,50,Corporate,
1656,6,SANJEEVANI MULTISPECIALITY HOSPITAL,"1-3-2206 VAIDYANATH PLAZA, NEAR SHIVAJI MAHARAJ STATUE,BARSHI ROAD, ABOVE AXIS BANK %E2%80%93 431122",431122.0,19.83987055397624,75.88983216326491,9422705199.0,35,Corporate,
1657,20,SANJIVANI CRITICAL CARE AND TRAUMA CARE CENTER,"Wadiya factory, Shivaji Nagar Nanded?%27,%27HSI5885%27)",431602.0,19.19919523752107,77.40079559161279,9890619657.0,55,Corporate,
1658,15,SANJYOT NETRALAY & ADITIYA EYE BANK,"INCHALKARANJI, KOLHAPUR ROAD, Hatkanangle, Kolhapur-416115",416115.0,16.405644230927294,74.28063041478133,9422413384.0,10,Corporate,
1659,2,SANMITRA MANAS AND VYASANMUKTI KENDRA,"AKOT ROAD,AKOT ROAD NEAR CEMENT GODOWN AKOLA",444001.0,20.70971908628904,76.9992516046727,9975628653.0,35,Corporate,
1660,35,SANSKRITI HOSPITAL,,,19.29529119900418,73.01968018979878,,30,Corporate,
1661,28,SANSKRUTI MULTISPECIALITY HOSPITAL,"VISHRAMBAG KUPWAD ROAD MANGALVAR BAJAR CHOUK, GANDHI COLONY, Miraj, Sangli-416416",416416.0,17.03421158711838,74.6017370380893,9623632349.0,50,Corporate,
1662,15,SANT GAJANAN MAHARAJ RURAL HOSPITAL,"MAHAGAON,KOLHAPUR",416503.0,16.6068942939554,74.30394321094306,8605009601.0,80,Corporate,
1663,15,"SANT GAJANAN MAHARAJ RURAL HOSPITAL, CHINCHEWADI,Kolhapur,Pvt","163,SAMAN GAD,GADHINGLAJ HALKARNI ROAD,",416502.0,16.6054942336015,74.3038584017313,9823617024.0,40,Corporate,
1664,14,SANT GAJANAN MULTISPECIALITY HOSPITAL,"11382/102/06,  Mantha Choufully , Ring road , chatrapati sambhaji nagar- jalna bypass road %E2%80%93 431203",431203.0,19.84040547659858,75.89058540681157,7447777910.0,48,Corporate,
1665,7,"SANTKRUPA HOSPITAL, CHIKHALI","121, BEHIND BUS STAND CHIKHALI, BULDANA JALNA BYE PASS HIGH WAY, CHIKHALI, 443201",443201.0,20.229983235157267,76.23925131632909,9665614209.0,35,Corporate,
1666,4,SANTPURE HOSPITAL,,,19.945267658205104,75.41961432438617,,30,Corporate,
1667,4,SAOJI MULTISPECIALITY HOSPITAL,,,19.94389616543781,75.41908313602919,,45,Corporate,
1668,13,SARA MULTISPECIALITY HOSPITAL PVT LTD,"01,SADASHIV NAGAR,BEHIND KASTURI HOTEL,MIDC ROAD ,MEHRUN ,JALGAON 425001",425001.0,20.46394590049392,75.00451982412851,9607770698.0,99,Corporate,
1669,26,SARASWATI EDUCATION SOCIETYS RAIGAD HOSPITAL AND RESEARCH CENTRE,"14 AND 15,KARJAT,VILLEGE DISKAL,TAHESIL KARJAT,RAIGAD",410201.0,18.89943227162462,73.32018174384594,9769824766.0,330,Corporate,
1670,35,SATYA SAI PLATINUM HOSPITAL,"Chopra Rd, near Aman Talkies, Sidhi Vinayak Nagar, Ulhasnagar, Maharashtra",421003.0,19.295938947637914,73.02022551283966,9370471117.0,75,Corporate,
1671,29,SAVITRI HOSPITAL,"LONAND - SHIRWAL ROAD,NEAR LONAND MIDC,LONAND,SATARA",415521.0,18.073092915472436,74.13770701193387,9890361022.0,50,Corporate,
1672,3,SDH - 100 - Achalpur,"Devadi Road, Near achalpur Police station",444806.0,21.08902134025401,77.47024548255276,9975470113.0,100,Government,DHS
1673,25,"SDH 100 Baramati, Dist. Pune","Silver Jubilee Sub-District Hospital, Patas Rd, Baramati, Maharashtra",413102.0,18.14983467879552,74.58401070898067,9689154522.0,100,Government,
1674,35,"SDH 100 Bhivandi, Dist. Thane","Near Bhiwandi Court, Agra Road, Bhiwandi, Dist.- Thane?%27,%27HSI69751%27)",421302.0,19.209878729404014,73.04738795897823,9049064472.0,100,Government,
1675,8,SDH 100 Chimur Dist Chandrapur,Warora Road Ta. Chimur Chandrapur,442903.0,20.63252151593909,79.40063637480446,9421727181.0,100,Government,
1676,13,SDH 100 Chopda Dist Jalgaon,"Maharashtra State Highway 4, Narayan Wadi, Vidya Vihar Colony, Chopda, Maharashtra",425107.0,20.76051260093492,74.84520615662316,9921199900.0,100,Government,
1677,36,SDH 100 Dahanu Dist Palghar,"Cottage Hospital, Agar, Dahanu, Maharashtra?%27,%27HSI69715%27)",401601.0,19.94491030734607,72.69398127304409,9881269912.0,100,Government,
1678,15,SDH 100 Gadhingalaj Dist Kolhapur,"Gandhinagar, Gadhinglaj, Maharashtra",416502.0,16.606934154919156,74.30279025677423,9767216877.0,100,Government,
1679,6,"SDH 100 Kaij, Dist. Beed","AMBAJOGAI ROAD,KAIJ Beed 431123",431123.0,18.781949237678123,76.01679818784046,7972426343.0,100,Government,
1680,12,"SDH 100 Kalamnuri, Dist Hingoli","Kalamnuri, Maharashtra",431702.0,77.13147758970544,19.64485916281398,9422132907.0,100,Government,
1681,27,"SDH 100 Kalmbani, Dist. Ratnagiri","A/P- Kalambani, Mumbai Goa Highway, Khed, Ratnagiri",410505.0,18.98818695043837,73.63517592489622,9970118959.0,70,Government,
1682,22,SDH 100 Kalwan Dist Nashik,"SH20, Kalvan, Kalwan Bk., Maharashtra?%27,%27HSI69696%27)",423501.0,20.4890945,74.0270675,9422266778.0,100,Government,
1683,19,"SDH 100 Kamthi, Nagpur","NH 44, Sanjay Nagar Bengali Colony, Kamptee, Maharashtra",441001.0,21.22667029173549,79.19026087204513,9923330625.0,50,Government,
1684,30,SDH 100 Kankawali Dist Sindhudurg,"Nardave Rd, Kankavli, Maharashtra",416602.0,16.31536041070747,73.62051270201825,9404507048.0,100,Government,
1685,33,"SDH 100 Karanja, Dist Washim","Shivaji Nagar, Karanja, Maharashtra?%27,%27HSI69702%27)",444105.0,20.570019471020007,77.59984489158006,9422962777.0,100,Government,
1686,20,SDH 100 Mukhed Nanded,At Post Mukhed Tq Mukhed Dist Nanded,431815.0,19.199719301952214,77.39177646580521,8308202249.0,100,Government,
1687,2,SDH 100 Murtizapur Dist Akola,"Patwari Colony, Murtizapur, Maharashtra",444107.0,20.709671114403395,77.39095204031506,9021120332.0,100,Government,
1688,23,SDH 100 Omarga Dist Osmanabad,"Main road,omerga",413606.0,17.832740611152452,76.62486055613407,8007000556.0,100,Government,
1689,26,SDH 100 Panvel Raigad,"Near Panvel Municipal Corporation, Panvel",410206.0,19.077175590810132,73.24069459349107,8850893600.0,100,Government,MCGM
1690,6,SDH 100 Parali Dist Beed,upajilla rugnalaya Rd Parli,431515.0,18.7315015486735,76.6309209157275,9822809283.0,100,Government,
1691,35,SDH 100 Sahapur Dist Thane,"Khade Vidyalay Rd, Shahapur, Maharashtra?%27,%27HSI69749%27)",421601.0,19.50924902092364,73.3469707854427,8424057421.0,100,Government,
1692,30,SDH 100 Sawantwadi Dist Sindhudurg,"Mumbai Goa Hwy, Khaskilwada, Sawantwadi, Maharashtra",416510.0,15.911744478751352,73.82346971908443,9623244716.0,100,Government,
1693,23,"SDH 100 Tuljapur, Dist. Osmanabad","Near of new bus stand ,tuljapur",413601.0,18.01912653238288,76.06485502175158,8275055952.0,100,Government,
1694,4,SDH 100 Vaijapur Dist Aurangabad,,,19.94538995795836,75.41994252021392,,100,Government,
1695,8,"SDH 100 Warora, Dist Chandrapur","Snehnagar, Warora, Maharashtra?%27,%27HSI69700%27)",442907.0,18.5559777,73.0532909,9623262749.0,100,Government,
1696,22,"SDH 100 Yeola , Dist Nashik","A/P Yeola, Block- Yeola %E2%80%93 Nashik %E2%80%93 423401",423401.0,20.026175389172376,74.42993884633925,8857876400.0,100,Government,
1697,29,SDH 100Karad Dist Satara,"Dadasaheb Chavan Nagar, At Post Warunji Phata, Karad",415110.0,17.687251074900768,74.00749036051916,9822274915.0,100,Government,
1698,10,SDH 50 Aheri,"Khamancheru Rd, Aheri, Maharashtra",442705.0,18.817978,79.529432,9423121760.0,50,Government,
1699,31,SDH 50 Akluj,"Akluj Irrigation Colony, Akluj, Maharashtra",413101.0,17.47808855041634,75.29809607028821,7020240058.0,50,Government,
1700,14,SDH 50 Ambad,"Jalna-Beed Rd, Ambad, Maharashtra",431204.0,19.614277,75.785009,9422216324.0,50,Government,
1701,10,SDH 50 Armori,"Tadulwar Nagar, Armori, Maharashtra",441208.0,20.63639357647059,79.42528696764707,9423991000.0,50,Government,
1702,32,SDH 50 Arvi,"Pulgao road, sdh arvi",442202.0,21.2081004,78.1963304,8412022003.0,50,Government,
1703,25,SDH 50 Bhor,"nera panchayaet samiti , Bhor Paune",412206.0,18.1116564,73.8596061,7499246038.0,50,Government,
1704,27,SDH 50 Dapoli,Dapoli %E2%80%93 415712,415712.0,17.76305,73.1987,,50,Government,
1705,34,SDH 50 Darwha,"Yash Plaza,Near Govinda Rickshaw stop Jalgaon",425001.0,20.46469735343993,75.00361070921285,917249673019.0,50,Government,
1706,3,SDH 50 Daryapur,"Daryapur, Amravati",444803.0,21.039080660322103,77.45940227308517,8888371749.0,50,Government,
1707,25,SDH 50 Daund,"Nagar Rd, Daund, Maharashtra",413801.0,18.46076725775351,74.56452549599348,9881385581.0,50,Government,
1708,9,SDH 50 Dondaicha,"Dondaicha, Maharashtra",425408.0,21.34725929899435,74.626145677783,9960409165.0,50,Government,
1709,15,SDH 50 Gandhinagar,"Kolhapur-Rukadi-Sangli Hwy, Bapat Camp, Kolhapur, Maharashtra",416005.0,16.606253906698385,74.30330370794877,9822002766.0,50,Government,
1710,24,SDH 50 Gangakhed,"Gangakhed Rd, Mahatma Fule Nagar, Gangakhed, Maharashtra?%27,%27HSI15581%27)",431514.0,76.749301,18.965452,8378948483.0,50,Government,
1711,20,SDH 50 Hadgaon,At Post Hadgauon Tq Hadgauon Dist Nanded,431712.0,19.199058341337143,77.40021020324448,9403882428.0,50,Government,
1712,25,SDH 50 Indapur,"Indapur, Near St Stand Indapur Pune",413106.0,18.101965489659698,75.09475634431477,9657002025.0,50,Government,
1713,28,SDH 50 Islampur,"Mantri Colony, Urun Islampur, Islampur",415409.0,17.02073388208566,74.2804934866156,8007281921.0,50,Government,
1714,13,SDH 50 Jamner,"Corner, Bhusawal Rd, Mahavir Nagar, Jamner, Maharashtra",424206.0,20.76205693292601,74.84582920644307,9423974868.0,50,Government,
1715,26,SDH 50 Karjat,"Aambetkar Chauk, karjat",410201.0,18.89926186250425,73.32039244287223,9527171855.0,50,Government,
1716,1,SDH 50 Karjat,"Karjat, Maharashtra?%27,%27HSI69726%27)",414402.0,18.459412147559878,75.59988245933818,8888450001.0,50,Government,
1717,31,SDH 50 Karmala,"Karmala, Maharashtra",413203.0,18.398424001577897,75.18778661680484,9970767155.0,50,Government,
1718,15,SDH 50 Kodoli,"Kodoli, Maharashtra",416114.0,16.605552280229464,74.30456855375094,9822913306.0,50,Government,
1719,10,SDH 50 Kurukheda,"Kurkheda, Maharashtra",441209.0,20.008489461204523,78.71212016552889,7060831485.0,50,Government,
1720,3,SDH 50 MORSHI,"Morshi, Amravati",444905.0,21.330488736408608,77.91023889014764,9970638265.0,50,Government,
1721,7,SDH 50 Malkapur,At Karla road moti nagar  pusad,445204.0,19.909467251284678,77.57166911020157,7507027048.0,50,Government,
1722,22,SDH 50 Manmad,"Bardiya Nagar, Manmad",423104.0,20.33053061696849,74.24371291363413,8329792472.0,50,Government,
1723,13,SDH 50 Muktainagar,At.post.Muktainagar -Tahshil back side muktainagar,425306.0,20.762223333404958,74.8458119850553,2583234218.0,50,Government,
1724,16,SDH 50 Nilanga,SUB DISTRICT HOSPITAL NILANGA,413521.0,18.128577938543867,76.75089794372312,9850780723.0,50,Government,
1725,22,SDH 50 Niphad,"Nandurdi Rd, Niphad, Maharashtra?%27,%27HSI69720%27)",422303.0,20.03719315538352,74.09960897822864,9404688077.0,50,Government,
1726,23,SDH 50 Paranda,"Near gov.rest house ,paranda",413502.0,18.28878749562699,75.43793411646192,8668874489.0,50,Government,
1727,1,SDH 50 Pathardi,"SH147, Navi Peth, Pathardi, Maharashtra?%27,%27HSI69721%27)",414102.0,19.16,75.18,8344215249.0,50,Government,
1728,26,SDH 50 Pen,Near By Pen Nagar Parishad Pen,402107.0,18.74094594500582,73.11220627238608,9604887163.0,50,Government,
1729,34,SDH 50 Pusad,At Karla road moti nagar  pusad,445204.0,19.90948342520776,77.57087115099763,7507027048.0,50,Government,
1730,19,SDH 50 Ramtek,"Ramtek, Maharashtra",441106.0,11.984492718925267,75.38122924226732,8446703055.0,50,Government,
1731,26,SDH 50 Roha,Opposite Mehandale Highschool Roha,402109.0,18.475220065367257,73.13097384730717,9011844453.0,50,Government,
1732,5,SDH 50 Sakoli,"Sakoli, Maharashtra?%27,%27HSI69722%27)",441802.0,21.158680877771285,79.95853680187348,7020172276.0,50,Government,
1733,24,SDH 50 Sello,"?Adarsh%20Nagar,%20Selu,%20Maharashtra%27,%27HSI6880%27)",431503.0,76.44094462794116,19.445684510432898,9158793978.0,50,Government,
1734,15,SDH 50 Seva Rugnalaya,"?Indumati%20Road,%20Police%20Head%20Quarters,%20Kolhapur,%20Maharashtra%27,%27HSI69806%27)",416006.0,16.733730529103504,74.24450615806857,9604961556.0,50,Government,
1735,30,SDH 50 Shiroda,"QMFJ+H37, Shiroda, Vengurla, Maharashtra 416518",416518.0,15.7981847,73.7008503,9834641243.0,50,Government,
1736,26,SDH 50 Shrivardhan,"Tilak road, near Somaji Temple, Shriwardhan",402110.0,18.0699723,73.0424685,9763154240.0,50,Government,
1737,21,SDH 50 Taloda,Taloda %E2%80%93 Nandurbar - 425413,425413.0,21.5455931,74.4683243,8329562771.0,50,Government,
1738,11,SDH 50 Tirora,"Near Vinayak Mandir,Railway Station Road,Tirora",441911.0,21.53931,80.025547,9975736319.0,50,Government,
1739,22,SDH 50 Trimbak,Trimbak Road %E2%80%93 Nashik %E2%80%93 422212,422212.0,19.88545,73.5336,9822547399.0,50,Government,
1740,35,SDH Ambarnath,Near Ambarnath Nagar palika Chhya Hospital Ambarnath 421501,421501.0,19.206381171359823,73.182067072317,9588685566.0,50,Government,
1741,12,"SDH Basmath,Govt,Hingoli","Near City Police Station, Bazar Road, Basmat-Hingoli",431512.0,77.15741138608675,19.329010107981496,8275108916.0,50,Government,
1742,22,SDH Chandwad and Trauma Unit,"Sub Hivarkhede, Near Chandwad Lasalgaon Road, Near Primary School, Chandvad, Nashik, Maharashtra",423101.0,20.31926679253892,74.25775674121121,9225108110.0,70,Government,
1743,20,SDH Deglur and Trauma Unit,At Post Degloor Tq Degloor Dist Nanded,431717.0,19.200034241776223,77.40052722095923,9404488887.0,50,Government,
1744,4,SDH Gangapur and Trauma Unit,,,19.944741976525258,75.41983936993608,,70,Government,
1745,6,SDH Georai and Trauma Unit,"NH211, Geeorai 431127",431127.0,19.300624692614093,75.38125019947884,9822232678.0,50,Government,
1746,20,SDH Gokunda and Trauma Unit,"At Post Gokunda Tq, Kinwat Dist Nanded",431804.0,19.199312662876785,77.39987406745091,9423627150.0,50,Government,
1747,23,SDH Kalamb,"Near MSRTC Bus Stand, Kalamb Ambejogai Road- Dharashiv %E2%80%93 413507",413507.0,18.571492778786176,76.01819508853927,8828095099.0,30,Government,
1748,27,SDH Kamthe And Trauma Unit,"A/P- Kamthe, Mumbai Goa Highwat, Chiplun, Ratnagiri?%27,%27HSI69725%27)",415605.0,17.533467474279593,73.516470266162,9604625656.0,50,Government,
1749,28,"SDH Kavthe Mahankal,Govt,Sangli",Jath Road near guest house,416405.0,17.0493415205669,74.86945367420465,9370049825.0,50,Government,
1750,23,SDH Naldurg,"Naldurg,Tuljapur Road Dharashiv %E2%80%93 413602",413602.0,17.80464,76.2162,7972236034.0,50,Government,
1751,21,SDH Navapur and Trauma Unit,"Navapur, Nandurbar, NH-6, Dhule Nagpur Kolkata Highway, Mumbai Highway, Nandurbar, Nandurbar, Maharashtra?%27,%27HSI69707%27)",425418.0,21.123061002036938,73.7127468776098,8390671554.0,50,Government,
1752,34,SDH Pandharkawada and Trauma Unit,"Pandharkawada, Maharashtra",445302.0,20.023224255017723,78.5452857548706,9423745360.0,50,Government,
1753,8,SDH Rajura,"Asifabaad road, Peth Ward, Rajura",442905.0,19.5733438,79.4422593,9960495284.0,100,Government,
1754,28,"SDH Shirala,Sangli,Govt","Near Ambamata Mandir Padali Road, Tal Shirala, Dist Sangli-415408",415408.0,17.01032581250469,74.11070507748171,9423548541.0,50,Government,
1755,9,SDH Shirpur Dhule,"Market Rd, Adarsh Nagar, Subhash Colony, Shirpur, Maharashtra?%27,%27HSI69793%27)",425405.0,21.366815879013576,74.83073302845166,9518537104.0,100,Government,
1756,1,SDH Shrirampur,"Taluka %E2%80%93 Shrimpur Distt-Ahmednagar, 413709",413709.0,19.48697885465804,74.9695831834811,9960698701.0,50,Government,
1757,4,SDH Sillod and Trauma Unit,,,19.945037404361774,75.41844003209441,,70,Government,
1758,3,SDH Tiosa,satargaon road near petrol pump sub district hospital tiwsa %E2%80%93 Amravati -444903,444903.0,21.0,78.07,7709955070.0,50,Government,
1759,34,SDH Umerkhed,"Sub District Hospital Umerkhed Pusad Road Umerkhed?%27,%27HSI96305%27)",445206.0,19.60107313000496,77.68981806354661,7743828902.0,50,Government,
1760,30,SDH Vengurla,"At Post - Vengurla, Tal. - Vengurla, Dist. Sindhudurg.- 416516",416516.0,15.910728270870647,73.65293142530415,9421265900.0,50,Government,
1761,4,SETH NANDALAL DHOOT HOSPITAL,,,19.9454236312482,75.41966784941555,,200,Corporate,
1762,25,SETH TARACHAND RAMNATH CHARITABLE AYURVEDIC HOSPITAL,"VAIDYA NANAL SHASTRI PATH, 592 RASTA PETH, Haveli, Pune-411011",411011.0,18.520429458072154,73.85981652556217,7620872144.0,222,Corporate,
1763,28,SEVA HOSPITAL,,,17.240282335037033,74.43217324406235,,50,Corporate,
1764,9,SEVA SUPERSPECIALITY AND CRITICAL CARE CENTRE,"mission compound,sakri road,near siddhivinayak hospital,DHULE",424001.0,20.925419372345807,74.7403997700983,8007388006.0,100,Corporate,
1765,28,SEVASADAN LIFELINE & SUPERSPECIALTY HOSPITAL,"Chandanwadi, Miraj-Sangli Road, Miraj",416410.0,17.034972265819974,74.60191006837378,8805809993.0,43,Corporate,
1766,15,SEVASADAN NIRAMAY PRIVATE LTD.,"NIRAMAYA HOSPITAL ,691/1,ICHALKARANJI,RING ROAD,NEAR BOHARA MARKET,KOLHAPUR",416115.0,16.40585340546591,74.27994635552307,9552542812.0,111,Corporate,
1767,22,SEVEN STARZ MULTISPECIALITY HOSPITAL,"SS COMPLEX, 1st FLOOR, XLO POINT, AMBAD,NASHIKSS COMPLEX, 1st FLOOR, XLO POINT, AMBAD,NASHIK - 422010",422010.0,19.93438023932164,73.76491171245371,9421608343.0,35,Corporate,
1768,17,SEVENHILLS HEALTHCARE PRIVATE LIMITED,,,18.958219095466013,72.83185956902733,,306,Corporate,
1769,35,SHALOM MEDICARE PVT. LTD,"Shalom Ark Indralok Phase-6, Opp Raj Classic Bhayander, Shalom Ark %E2%80%93 401105",401105.0,19.309535870456006,72.85593349643914,8850756944.0,31,Corporate,
1770,35,SHAMAN CANCER CARE,"SURVEY NO 36/7 A&C ,GOVELI TAL-KALYAN DIST-THANE 421401",,19.294813080455626,73.01953427397396,9769848969.0,35,Corporate,
1771,25,"SHANKARRAO MASULKAR URBAN HEALTH CENTER AND EYE HOSPITAL,PUNE CITY,GOVT","Masulkar Colony, Ajmera Housing Society, Pimpri Colony, Pimpri-Chinchwad, Maharashtra 411018",411018.0,18.631767031102704,73.81992924546488,8446106003.0,80,Government,
1772,34,SHANTI ORTHOPAEDIC HOSPITAL,"52,DATTA CHOWK,YAVTMAL,",445001.0,20.413661919029185,78.13391906635015,9422165737.0,33,Corporate,
1773,17,SHANTILAL SHANGHVI CANCER CENTER,,,18.95872105873489,72.83139937472059,,49,Corporate,
1774,17,SHANTILAL SHANGHVI EYE INSTITUTE,,,18.95834330666517,72.83160693407149,,49,Corporate,
1775,7,SHANTIPAD HOSPITAL,"BHAIRAV CHWOK SHEGAON, BHAIRAV CHWOK, BHAIRAV CHWOK, 444203",444203.0,20.8562761236338,76.70001305202811,7588565194.0,15,Corporate,
1776,28,SHARADA MULTISPECIALITY HOSPITAL,"NEAR BHARAT SUTGIRAN CHOWK, SANGLI KUPWAD ROAD, MIRAJ, Sangli-416416",416416.0,17.034066281447135,74.60145183622299,9960541260.0,32,Corporate,
1777,35,SHARDA HOSPITAL,,,19.294346293235467,73.02060162497607,,35,Corporate,
1778,14,SHASHWAT HOSPITAL,NEAR BHARAT PETROL PUMP SILLOD RAOD BHOKARDAN %E2%80%93 431114,431114.0,20.253715265297046,75.7682486478934,7709001404.0,30,Corporate,
1779,25,"SHASWAT HOSPITAL KOTHRUD,PUNE CITY,PUNE","22, HAPPY COLONY KOTHRUD, MALWADI ROAD, PUNE CITY, PUNE- 411038",411038.0,18.51062036462565,73.81984210645668,7666647874.0,56,Corporate,
1780,19,SHAT-AYU HOSPITAL & RESEARCH CENTRE,"plot No. 26, WARDHA ROAD NEAR HITVADA PRESS DHANTOLI NAGPUR %E2%80%93 440012",440012.0,21.41383605931767,78.8416830495793,9822565161.0,50,Corporate,
1781,22,SHATABDI SUPER SPECIALITY HOSPITAL,"SUYOJIT CITY CENTER ,OPP. MAHAMARG?%20BUS%20STAND,%20MUMBAI%20NAKA,NASHIK%27,%27HSI1163%27)",422005.0,19.98936199935848,73.72021849484133,9960007777.0,76,Corporate,
1782,7,SHATAYUSHI SURGICAL HOSPITAL AND CANCER CENTER,"22/113 PLOT 6,OFF JAMBHRUN ROAD,BEHIND ST STAND,BULDHANA 443001",443001.0,20.533539090537182,76.17851646890206,8697474007.0,30,Corporate,
1783,26,SHELAR HOSPITAL AND ICU,PLOT NO 9 SEC 1 KHANDA COLONY RELIANCE MART NEAR 410206,410206.0,19.077281420449456,73.2398278521161,9323652505.0,35,Corporate,
1784,31,"SHID ACCIDENT HOSPITAL, AKLUJ","GIRZANI CHOWK, AKLUJ, MALSHIRAS, SOLAPUR-413101",413101.0,17.477052116932203,75.29799167422124,9922970416.0,30,Corporate,
1785,4,SHIFA MULTI SPECIALITY HOSPITAL,,,19.945155357827243,75.41909207475608,,30,Corporate,
1786,14,SHINDE BAL RUGNALAYA,"11482/36 NEW MONDHA ROAD VAIBHAV COLONY, JALNA- 431203",431203.0,19.839359318578055,75.89037821816298,9850950925.0,20,Corporate,
1787,9,SHIRPUR WARWADE NAGR PARISHAD SANCHLITH INDIRA GANDHI MEMORIAL HOSITAL,,,21.09004289888889,74.48047091592592,,101,Government,
