hospital_id,district_id,hospital_name,address,pincode,latitude,longitude,mco_contact_number,total_beds,hospital_type,government_subtype
1756,1,SDH Shrirampur,"Taluka %E2%80%93 Shrimpur Distt-Ahmednagar, 413709",413709.0,19.4860278,74.9699167,9960698701.0,50,Government,
1757,4,SDH Sillod and Trauma Unit,,,19.944847311671925,75.41925964069401,,70,Government,
1758,3,SDH Tiosa,satargaon road near petrol pump sub district hospital tiwsa %E2%80%93 Amravati -444903,444903.0,21.0,78.07,7709955070.0,50,Government,
1759,34,SDH Umerkhed,"Sub District Hospital Umerkhed Pusad Road Umerkhed?%27,%27HSI96305%27)",445206.0,19.6008611,77.6906388,7743828902.0,50,Government,
1760,30,SDH Vengurla,"At Post - Vengurla, Tal. - Vengurla, Dist. Sindhudurg.- 416516",416516.0,15.9098098,73.6525001,9421265900.0,50,Government,
1761,4,SETH NANDALAL DHOOT HOSPITAL,,,19.944847311671925,75.41925964069401,,200,Corporate,
1762,25,SETH TARACHAND RAMNATH CHARITABLE AYURVEDIC HOSPITAL,"VAIDYA NANAL SHASTRI PATH, 592 RASTA PETH, Haveli, Pune-411011",411011.0,18.52025,73.8599167,7620872144.0,222,Corporate,
1763,28,SEVA HOSPITAL,,,17.23956558827751,74.43125957272727,,50,Corporate,
1764,9,SEVA SUPERSPECIALITY AND CRITICAL CARE CENTRE,"mission compound,sakri road,near siddhivinayak hospital,DHULE",424001.0,20.9254213,74.7395367,8007388006.0,100,Corporate,
1765,28,SEVASADAN LIFELINE & SUPERSPECIALTY HOSPITAL,"Chandanwadi, Miraj-Sangli Road, Miraj",416410.0,17.0348056,74.6018333,8805809993.0,43,Corporate,
1766,15,SEVASADAN NIRAMAY PRIVATE LTD.,"NIRAMAYA HOSPITAL ,691/1,ICHALKARANJI,RING ROAD,NEAR BOHARA MARKET,KOLHAPUR",416115.0,16.40594444,74.28052778,9552542812.0,111,Corporate,
1767,22,SEVEN STARZ MULTISPECIALITY HOSPITAL,"SS COMPLEX, 1st FLOOR, XLO POINT, AMBAD,NASHIKSS COMPLEX, 1st FLOOR, XLO POINT, AMBAD,NASHIK - 422010",422010.0,19.9353728,73.7654287,9421608343.0,35,Corporate,
1768,17,SEVENHILLS HEALTHCARE PRIVATE LIMITED,,,19.446040649122807,72.36373664912281,,306,Corporate,
1769,35,SHALOM MEDICARE PVT. LTD,"Shalom Ark Indralok Phase-6, Opp Raj Classic Bhayander, Shalom Ark %E2%80%93 401105",401105.0,19.3096389,72.8549722,8850756944.0,31,Corporate,
1770,35,SHAMAN CANCER CARE,"SURVEY NO 36/7 A&C ,GOVELI TAL-KALYAN DIST-THANE 421401",,19.295112535714285,73.01962990809524,9769848969.0,35,Corporate,
1771,25,"SHANKARRAO MASULKAR URBAN HEALTH CENTER AND EYE HOSPITAL,PUNE CITY,GOVT","Masulkar Colony, Ajmera Housing Society, Pimpri Colony, Pimpri-Chinchwad, Maharashtra 411018",411018.0,18.6325,73.82083333,8446106003.0,80,Government,
1772,34,SHANTI ORTHOPAEDIC HOSPITAL,"52,DATTA CHOWK,YAVTMAL,",445001.0,20.4131111,78.1337777,9422165737.0,33,Corporate,
1773,17,SHANTILAL SHANGHVI CANCER CENTER,,,19.446040649122807,72.36373664912281,,49,Corporate,
1774,17,SHANTILAL SHANGHVI EYE INSTITUTE,,,19.446040649122807,72.36373664912281,,49,Corporate,
1775,7,SHANTIPAD HOSPITAL,"BHAIRAV CHWOK SHEGAON, BHAIRAV CHWOK, BHAIRAV CHWOK, 444203",444203.0,20.85682,76.70099,7588565194.0,15,Corporate,
1776,28,SHARADA MULTISPECIALITY HOSPITAL,"NEAR BHARAT SUTGIRAN CHOWK, SANGLI KUPWAD ROAD, MIRAJ, Sangli-416416",416416.0,17.0348056,74.6018333,9960541260.0,32,Corporate,
1777,35,SHARDA HOSPITAL,,,19.295112535714285,73.01962990809524,,35,Corporate,
1778,14,SHASHWAT HOSPITAL,NEAR BHARAT PETROL PUMP SILLOD RAOD BHOKARDAN %E2%80%93 431114,431114.0,20.254098,75.768988,7709001404.0,30,Corporate,
1779,25,"SHASWAT HOSPITAL KOTHRUD,PUNE CITY,PUNE","22, HAPPY COLONY KOTHRUD, MALWADI ROAD, PUNE CITY, PUNE- 411038",411038.0,18.5112222,73.8196667,7666647874.0,56,Corporate,
1780,19,SHAT-AYU HOSPITAL & RESEARCH CENTRE,"plot No. 26, WARDHA ROAD NEAR HITVADA PRESS DHANTOLI NAGPUR %E2%80%93 440012",440012.0,21.41470797226994,78.84095818131902,9822565161.0,50,Corporate,
1781,22,SHATABDI SUPER SPECIALITY HOSPITAL,"SUYOJIT CITY CENTER ,OPP. MAHAMARG?%20BUS%20STAND,%20MUMBAI%20NAKA,NASHIK%27,%27HSI1163%27)",422005.0,19.988439,73.720725,9960007777.0,76,Corporate,
1782,7,SHATAYUSHI SURGICAL HOSPITAL AND CANCER CENTER,"22/113 PLOT 6,OFF JAMBHRUN ROAD,BEHIND ST STAND,BULDHANA 443001",443001.0,20.5336389,76.1794722,8697474007.0,30,Corporate,
1783,26,SHELAR HOSPITAL AND ICU,PLOT NO 9 SEC 1 KHANDA COLONY RELIANCE MART NEAR 410206,410206.0,19.077,73.24,9323652505.0,35,Corporate,
1784,31,"SHID ACCIDENT HOSPITAL, AKLUJ","GIRZANI CHOWK, AKLUJ, MALSHIRAS, SOLAPUR-413101",413101.0,17.477512,75.298578,9922970416.0,30,Corporate,
1785,4,SHIFA MULTI SPECIALITY HOSPITAL,,,19.944847311671925,75.41925964069401,,30,Corporate,
1786,14,SHINDE BAL RUGNALAYA,"11482/36 NEW MONDHA ROAD VAIBHAV COLONY, JALNA- 431203",431203.0,19.84,75.89,9850950925.0,20,Corporate,
1787,9,SHIRPUR WARWADE NAGR PARISHAD SANCHLITH INDIRA GANDHI MEMORIAL HOSITAL,,,21.09004289888889,74.48047091592592,,101,Government,
1788,22,SHIV CHILDRENS HOSPITAL & NEONATAL CARE CENTRE,"JYOTI NAGAR, MALEGAON ,OLD AGRA ROAD, NEAR HONDA PANCHGANGA SHOW-ROOM - 423203",423203.0,20.5533619,74.5080312,9423142005.0,15,Corporate,
1789,22,SHIV MULTISPECIALITY HOSPITAL AND CRITICAL CARE,"7,8,9,SATPUR,TRIMBAK ROAD,PAPAYA NURSURY,NASHIK",422007.0,20.2041737,73.8271949,9075756526.0,50,Corporate,
1790,6,SHIVAJIRAO HEART CARE AND IMAGING CENTER,"Plot no. %C2%BE , YASHAVANTRAO CHAVAN NATYGHRAY ROAD BEED %E2%80%93 432211",432211.0,18.957224548181816,75.62572569424242,9096293181.0,40,Corporate,
1791,6,SHIVKAMAL HOSPITAL AND RESEARCH INSTITUTE,"Plot No. 1-6-1222 , JALANA ROAD , BEHIND MANTRI BANK %E2%80%93 431122",431122.0,19.839128,75.890447,8446598646.0,35,Corporate,
1792,22,SHIVMUDRA MULTYSPECIALITY HOSPITAL,"VADALI BHOI,NH3,Nashik",423117.0,20.32996,74.243787,7588013129.0,30,Corporate,
1793,35,SHIVSHAHI NEUROCRITICARE AND MULTISPECIALITY HOSPITAL,Ved paradise ground floor mahalaxmi Nagar Ambernath East  421501,421501.0,19.2072778,73.18275,8976823606.0,35,Corporate,
1794,25,SHRADDHA HOSPITAL,"GHOTAWADE PHATA, PUNE KOLAD ROAD, OPPOSITE JIJAMATA BANK, MULSHI, PUNE-412115",412115.0,18.501116,73.750767,9665532597.0,35,Corporate,
1795,13,SHREE ACCIDENT HOSPITAL AND TRAUMA CARE CENTER,"DHEKU ROAD CORNER,AMALNER,JALGAON",425401.0,21.042874,75.061464,7709959191.0,30,Corporate,
1796,35,SHREE ASHIRWAD HOSPITAL,"SHOP NO 9 TO 15 SAI ANGAN APP.NEAR ADITI HOTEL , SAMARTH CHOWK BADLAPUR WEST, 421503",421503.0,19.150013,73.266654,8379990322.0,25,Corporate,
1797,14,SHREE BAL RUGNALAY AND CRITICAL CARE,"GROUND FLOOR , NEAR SHIVAJI PUTLA RD, GAWALI PURA , KADRABAD ROAD - 431203",431203.0,19.84,75.89,9370006612.0,10,Corporate,
1798,29,SHREE BALAJI MULTI SPECIALITY HOSPITAL SHIRWAL,"Plot no 522 c c no 1324, Shirwal  Tal Khandala Dist Satara, National Heighway 4 Service Road Azad Theatre %E2%80%93 412108",412108.0,18.5010616,73.5137574,9975451502.0,50,Corporate,
1799,16,SHREE BALRUGNALYA AND CLINIC,"UDGIR, MONDHA ROAD, MAHJAN COMPLEX - 413517",413517.0,18.3710497,77.134958,9665481515.0,30,Corporate,
1800,13,SHREE HARI MULTISPECIALITY HOSPITAL,"BHUSAWAL,IN FRONT OF TEHSIL OFFICE, JALGAON ROAD, BHUSAWAL, 425201",425201.0,20.76134140182927,74.84583924085365,8669090690.0,30,Corporate,
1801,27,SHREE HOSPITAL,"1ST FLOOR PRIME CENTER OPP SBI BANK,CHINCHNAKA, ABOVE PNG SHOP, Taluka %E2%80%93 Chiplun %E2%80%93 Ratnagiri %E2%80%93 415605",415605.0,17.533306,73.516694,9822688880.0,42,Corporate,
1802,28,SHREE HOSPITAL,KAMERI NAKA ISLAMPUR WALWA SANGLI 415409,415409.0,17.02,74.28,8485830903.0,30,Corporate,
1803,1,SHREE HOSPITAL ACCIDENT & SUPERSPECIALITY,"C.S.No.338 / 2 , Milkat No.2149,Plot No. 2,TISGAON TAL-PATHARDI,MIRI ROAD,NEAR NH-222,Ahmadnagar",414106.0,19.21,75.13,9850831917.0,50,Corporate,
1804,35,SHREE KKASTURI MEDICARE PVT. LTD.,"HARSHNIKETAN,GAONDEVI ROAD,HOTEL NAVRANG,BHAYANDER (WEST),",401101.0,19.2982232,72.824575,9324547676.0,50,Corporate,
1805,28,"SHREE MAHALAXMI MULTI SPECIALITY HOSPITAL,Pvt,Sangli","MHASOBA GATE, KAVATHE MAHANKAL, SANGLI-416405",416405.0,17.05,74.87,9420441873.0,30,Corporate,
1806,35,SHREE MAHAVIR JAIN HOSPITAL AND SHRI PRATAP J ASHAR CARDIAC CENTRE,"128 & 129 ,LOUISWADI CIRCLE , HAJURI DARGAH ROAD - 400604",400604.0,19.1860556,72.9577778,8600147742.0,100,Corporate,
1807,25,SHREE MAYURESHWAR RURAL HOSPITAL,"Gat No 211,KEDGAON - CHAUFFULA ROAD,KEDGAON - CHAUFFULA ROAD,NEAR ANNAPURNA HOTEL,PUNE",412203.0,18.529252,74.336752,9881001870.0,50,Corporate,
1808,25,SHREE MINERVA HOSPITAL & REASEARCH CENTER,"13-01, INGLE PRIDE, NDA KHAWASLA ROAD, SHIVANE, Haveli, Pune-411023",411023.0,18.441813,73.787742,9923232233.0,35,Corporate,
1809,25,SHREE MULTISPECIALITY HOSPITAL & ICU,"GAT NO 284 MOSHI DEHURASTA, MOSHI, NEAR BHARATMATA CHOWK, PUNE-412105",412105.0,18.6856,73.9441,9860590399.0,30,Corporate,
1810,4,SHREE MULTISPECIALITY HOSPITAL AND ICU,,,19.944847311671925,75.41925964069401,,45,Corporate,
1811,6,SHREE NARAYANI CHILD CARE UNIT,"ADARSH NAGAR, NEAR UMAKIRAN COMPLEX , TENDULKAR COLONY BEED - 431122",431122.0,19.839128,75.890447,9096330447.0,30,Corporate,
1812,15,SHREE ORTHO AND TRAUMA CENTER,,,16.60630039894737,74.30376235873685,,100,Corporate,
1813,34,SHREE ORTHOPAEDICS AND TRAUMA CENTER,VEER VAMANRAO CHOWK DATTA CHOWK ROAD 445001,445001.0,20.4131111,78.1337777,7798616729.0,30,Corporate,
1814,13,SHREE RHIDAYAM MULTISPECIALITY & HEART CENTRE,"SURANA TOWER, BEHIND BRAHMAN SANGH, JAMNER ROAD, NEAR IDBI BANK 425201",425201.0,20.76134140182927,74.84583924085365,9422856493.0,30,Corporate,
1815,9,SHREE SAI ACCIDENT AND EYE HOSPITAL,"21, Gitai Nagar, Dhule Highway, Sakri, Dhule-424304",424304.0,21.08715,74.3601,9422343840.0,10,Corporate,
1816,1,SHREE SAI CHAITANYA HOSPITAL,"GAJANAN  COLONY , NAVANAGAPUR ROAD, WADGON GUPTA ROAD. %E2%80%93 AHMEDNAGAR",414111.0,19.15,74.71,9850502398.0,40,Corporate,
1817,19,SHREE SAI EYE HOSPITAL,"ANAND PALACE 7-8 BESIDE SBI, SAKKARDARA BHANDE PLOT , UMRED ROAD NAGPUR %E2%80%93 440009",440009.0,21.41470797226994,78.84095818131902,9673344488.0,10,Corporate,
1818,20,SHREE SAMART NIWGHEKAR HOSPITAL,"2-9-467, MILGATE ROAD, NEAR TVS SHOWROOM, NANDED %E2%80%93 431601",431601.0,20.554431,74.512024,9591825884.0,10,Corporate,
1819,2,SHREE SAMARTHA MULTISPECIALITY HOSPITAL AND RESEARCH CENTER,RIDHORA AKOLA - 444001,444001.0,20.71,77.0,8180869555.0,100,Corporate,
1820,22,SHREE SEVA HOSPITAL,"OZAR GAON,NASHIK",422206.0,20.07853,74.1048596,9850135999.0,25,Corporate,
1821,4,SHREE SIDHHIVINAYAK MULTISPECIALITY HOSPITAL,,,19.944847311671925,75.41925964069401,,21,Corporate,
1822,16,SHREE TIRUPATI HOSPITAL AND CRITICAL CARE CENTER,"OLD RENAUR NAKA, BEHIND WEST SIDE MAOL AMBAJOGAI ROAD 413512",413512.0,19.968664,73.831608,9890469844.0,30,Corporate,
1823,35,SHREEDEVI HOSPITAL,"Akash Arcade, Deepak Shetty Road Bail Bazar Circle Near Bhanu Sagar Cinema, Kalyan West, Mumbai, Maharashtra?%27,%27HSI18477%27)",421301.0,19.5353,76.1449,9321308835.0,50,Corporate,
1824,22,SHREEJI MEDICITY HOSPITAL,"13, NEAR WASAN BAJAJ SHOWROOM- 422202",422202.0,20.2017969,73.8307798,7020343380.0,100,Corporate,
1825,29,SHREEYASH MULTISPECIALITY HOSPITAL,"YASH NIWAS MOHOPADA, RASAYANI MOHOPADA DAND ROAD NEAR RICKSHAW STAND 410222",415502.0,17.6544363,74.3675386,9096768311.0,30,Corporate,
1826,19,SHREYASH PATIL MULTISEPCIALITY HOSPITAL AND NURSING HOME,"NAGPUR SAONER ROAD,SAONER?%27,%27HSI73058%27)",441107.0,21.305863,78.947739,9923595445.0,35,Corporate,
1827,13,SHRI AASHIRWAD ACCIDENT HOSPITAL,"13,AASARAM NAGAR ,FAIZPUR,YAWAL ROAD,NEAR BUS STAND.JALGAON",425503.0,20.76134140182927,74.84583924085365,9975942738.0,50,Corporate,
1828,29,SHRI BALAJI SUPERSPECIALITY HOSPITAL,"251,station road,NEAR KRISHNA BRIDGE,SATARA",415110.0,17.6881944,74.0068333,9822501513.0,100,Corporate,
1829,27,SHRI BHAGWAN MAHADEV SAMBARE MOFAT RUGNALAY,"648/15/A Nchane Road ,Near ITI College Ratnagiri 415612",415612.0,17.01779,73.27482,7972322862.0,30,Corporate,
1830,17,SHRI CHHATRPATI SHIVAJI MAHARAJ DIALYSIS CENTER,,,19.446040649122807,72.36373664912281,,10,Corporate,
1831,25,SHRI GANPATI HEALTH CARES VEDANTA CRITICARE MULTISPECIALITY HOSPITAL CARDIAC AND ADVANCE TRAUMA CARE CENTER,"280/2/B/2, MAHADEV NAGAR, JOSHIWADI, OLD NAGAR PUNE HIGHWAY, SHIRUR, PUNE-412210",412210.0,18.8258964,74.3792657,9960535949.0,102,Corporate,
1832,22,SHRI GURUJI RUGNALAYA,"ANANDWALLI , CHOWK,GANGAPUR ROAD,NASHIK?%27,%27HSI25172%27)",422013.0,20.03025,73.6953,8380011286.0,45,Corporate,
1833,6,SHRI GURUKRUPA MULTISPECIALITY HOSPITAL AND RESEARCH CENTER BEED,"BEED, JALNA ROAD, BEHIND MANTRI BANK - 431122",431122.0,19.839128,75.890447,8668271437.0,30,Corporate,
1834,17,"SHRI K.V.O. JAIN MANAV SEVA KENDRA, DAHISAR",,,19.446040649122807,72.36373664912281,,11,Corporate,
1835,17,SHRI K.V.O.JAIN MANAV SEVA KENDRA,,,19.446040649122807,72.36373664912281,,23,Corporate,
1836,15,SHRI LAXMINARAYAN JANASEVA RUGNALAYA AND MEDICAL RESEARCH CENTRE,"1325/83, E WARD , SHIVAJI UDYAMNAGAR, Kolhapur-416008",416008.0,16.68958333,74.24847222,9822112271.0,50,Corporate,
1837,31,SHRI MARKANDEY SOLAPUR SAHAKARI RUGNALAYA AND RESEARCH CENTRE NIYAMIT,"Final Plot No 19,Markandeya Hospital,SOLAPUR",413005.0,17.6816944,75.9273056,9370602999.0,150,Corporate,
1838,15,SHRI PANCHGANGA HOSPITAL,"D WARD, SHUKRAWAR PETH, PANCHAGANGA ROAD KOLHAPUR-416012",416012.0,16.41294444,74.13072222,9422494130.0,40,Government,
1839,19,SHRI RADHAKRISHNA HOSPITAL AND RESEARCH INSTITUTE,"central avenue road,wardhaman nagar,",440008.0,21.14641667,79.12127778,8329213445.0,150,Corporate,
1840,27,SHRI RAMNATH HOSPITAL,"LOTLIKAR PLAZA,SHIVAJI NAGAR ROAD,NEAR MARUTI MANDIR,RATNAGIRI",415612.0,17.01779,73.27482,8308841195.0,105,Corporate,
1841,15,SHRI RENUKA MULTISPECIALITY HOSPITAL AND ICU,"Main Road, Near Mahadev Mandir, Balinga, Karvir, Kolhapur-416010",416010.0,16.60630039894737,74.30376235873685,9850469896.0,30,Corporate,
1842,1,SHRI SAIBABA HOSPITAL SHIRDI,,,19.26543469320783,74.63757631228916,,200,Corporate,
1843,1,SHRI SAINATH HOSPITAL SHIRDI,"SHIRDI , 423109",423109.0,19.7614088,74.5224953,7588524171.0,300,Corporate,
1844,7,SHRI SEVA HOSPITAL,"KHAMGAON, CIVIL LINES,CIVIL LINES, 444303",444303.0,20.348496,76.113151,9011692908.0,30,Corporate,
1845,5,SHRI SHYAM HOSPITAL & TRAUMA CENTER,"MAIN ROAD,BEHIND AGRAWAL PETROL PUMP,SAKOLI,BHANDARA 441802",441802.0,21.157976,79.95844,7517333466.0,30,Corporate,
1846,2,SHRI SIDDHIVINAYAK FRACTURE AND ACCIDENT HOSPITAL,"BAKHARIYA JEEN POPATKHED ROAD AKOT , POPATKHED RAOD %E2%80%93 444101",444101.0,21.15,77.07,9130909046.0,8,Corporate,
1847,27,SHRI SIDDHIVINAYAK MULTISPECIALLITY HOSPITAL RAMPUR,879A NEAR RAMPUR GRAMPANCHAYAT CHIPLUN GUHAGAR HIGHWAY RAMPUR 415701,415701.0,17.533307,73.516693,9881983383.0,30,Corporate,
1848,6,SHRI SIDDIVINAYAK NETRALAYA,"LAXMIBAUG COLONY,NAGAR ROAD, Beside Govt Rest House. Nagar Road,",431122.0,19.839128,75.890447,7002099181.0,5,Corporate,
1849,14,SHRI VINAYAK HOSPITAL JALNA,"Agrasen Nagar, Krushnakunj, Jalna %E2%80%93 431203",431203.0,19.84,75.89,9823559201.0,32,Corporate,
1850,19,SHRIDHA HOSPITAL AND RESEARCH INSTITUTE (A UNIT OF SDL HEALTHCARE PVT LTD),3 WARDHA ROAD AJANI METRO STATION NAGPUR 440015,440015.0,21.41470797226994,78.84095818131902,9326212101.0,50,,
1851,1,SHRIGONDA MATOSHRI HOSPITAL PVT.LTD.,"BALAJINAGAR, SHRIGONDA %E2%80%93 Ahilyanagar %E2%80%93 413701",413701.0,18.61,74.7,9860860230.0,31,Corporate,
1852,8,SHRIHARI NETRALAYA,"24, Chimur, NUTAN ADARSH COLONY, Chandrapur",442903.0,20.6322941,79.4000493,9892982233.0,5,Corporate,
1853,13,SHRIPAD ACCIDENT & ENT HOSPITAL,"5, VIVEKANAND NAGAR ZILLA PETH INDIA GARAGE ROAD NEAR THORSANMITRA MANGAL KARYALAYA 425001",425001.0,20.46428,75.004181,9422981600.0,50,Corporate,
1854,29,SHRISAI HOSPITAL & CRITICARE,LONAND %E2%80%93 Satara %E2%80%93 415521,415521.0,18.07225,74.13675,8805257070.0,31,Corporate,
1855,2,SHUKLA CHILDREN MULTI SPECIALITY HOSPITAL AND TEST TUBE BABY CENTER,"01,GANGADHAR PLOT STATION RAOD AKOLA,STATION ROAD,AKOLA",444001.0,20.71,77.0,9423115716.0,55,Corporate,
1856,35,SHUSHRUSHA HEART CARE CENTRE SPECIALITY HOSPITAL,"22A PALM BEACH ROAD NERUL SECTOR-6, ZAMA SWEET",400706.0,19.035,73.022,9322297664.0,52,Corporate,
1857,29,SHWAS MULTISPECIALITY HOSPITAL,Opposite seven star mall Wani Guruvarya colony nandpera road 445304,415001.0,17.6881944,74.0068333,9096999920.0,30,Corporate,
1858,29,SIDDHANATH LIFELINE MULTISPECAILITY HOSPITAL MAYANI LLP,"A/P MAYANI, MALHARPETH, CHITALI ROAD , CHANDANI CHOWK - 415102",415102.0,17.6544363,74.3675386,8010652307.0,30,Corporate,
1859,17,SIDDHARTH MUNICIPAL GENERAL HOSPITAL,,,19.446040649122807,72.36373664912281,,30,Government,
1860,9,SIDDHESWER HOSPITAL,"35/39,?%20DHULE,?%20GURD%20COLONY,?%20DEVPUR%27,%27HSP1810110018%27)",424005.0,20.9673566,74.7836721,8888873803.0,104,Corporate,
1861,22,SIDDHIVINAYAK HOSPITAL,"Plot No. 131, BEHIND STATE BANK OF INDIA, MOTI KAMAL TOWAR (SINNAR) %E2%80%93 422103",422103.0,19.78894,74.0153,8888669050.0,30,Corporate,
1862,13,SIDDHIVINAYAK HOSPITAL,521/A/2 NEAR ICCHADEVI SQUAREN H53 425001,425001.0,20.46428,75.004181,9422283331.0,40,Corporate,
1863,35,SIDDHIVINAYAK HOSPITAL,"S1, Tulsi Dham, Vedant Complex, Vartak Nagar, Thane (W), Thane, Maharashtra",400606.0,19.2060278,72.9669444,9769545533.0,50,Corporate,
1864,25,SIDDHIVINAYAK HOSPITAL AND RESEARCH CENTRE,"gat.no.88,cheladi nasarapur road at NH-4,",412213.0,18.23545,73.83735,9890367362.0,100,Corporate,
1865,13,SIDDHIVINAYAK MULTISPECIALITY HOSPITAL,"FIRST FLOUR S S PATIL CONSTRUCTION BULDING, PACHORA IN FROANT OF GAJANAN PETROL PUMP, M.M. COLLEGE CHOWK, JALGAON 424201",424201.0,20.67547,75.315,7709105764.0,40,Corporate,
1866,35,SIDDHIVINAYAK MULTISPECIALTY HOSPITAL & CARDIAC CARE CENTRE,"Kalyan-Murbad Rd, opp. ICICI Bank, Brahmin Society, Syndicate, Kalyan",421301.0,19.5353,76.1449,9699969409.0,50,Corporate,
1867,15,SIDDHIVINAYAK NURSING HOME,"1195 E Ward,Infront of Mahagoankar Complex,Takala Main Road,Near Kamla College,KOLHAPUR",416012.0,16.41294444,74.13072222,9422043350.0,50,Corporate,
1868,1,SIDHAKALA HOSPITAL,"19,SANGAMNER KHURD,PIMPARNE ROAD,AHMADNAGAR",422605.0,19.612829,74.101239,9766786123.0,100,Corporate,
1869,22,SIGNUS HOSPITAL,"5th Floor Atlanta Shoppers, PATHARDI PHATA, ATLANTA SHOPPERS %E2%80%93 Nashik 422010",422010.0,19.9353728,73.7654287,8237224365.0,50,Corporate,
1870,35,SILVER CREST HOSPITAL,90FT THAKURLI 421201,421201.0,19.2167,73.0833,9022243386.0,40,,
1871,22,SILVER MULTI SPECIALITY HOSPITAL,"SOMNATH PARK , BHAGCHANDRA  COMPLEX, DINDORII NAKA , PANCHAVATI - 422003",422003.0,20.080116,74.109816,9921009070.0,35,Corporate,
1872,4,SILVERLINE MULTISPECIALITY HOSPITAL,,,19.944847311671925,75.41925964069401,,50,Corporate,
1873,22,SIMS Yashodhan Multispeciality Hospital,"5, Abhona Road, New Cidco, Abhona, Maharashtra?%27,%27HSI83717%27)",423502.0,20.5417,73.8265,8275587261.0,37,Corporate,
1874,22,SINDHUTAI VIKHE PATIL MEMORIAL HOSPITAL AP CHINCHOLI SINNAR NASHIK,"GUT NO.109&110 ,CHINCHOLI ,NASHIK SINNAR HIGHWAY,SINNAR",422102.0,19.850007,73.999993,8390901150.0,300,Corporate,
1875,25,SITAI HOSPITAL,"KESHNAND, THEUR ROAD, CHATRAPATI SHIVAJI MAHARAJ CHOWK, Haveli, Pune-412207",412207.0,18.5458332,74.20912,8766497878.0,30,Corporate,
1876,22,SIX SIGMA MEDICARE & RESEARCH LTD.,"MAHATMA NAGAR,OPP WATER TANK,NASHIK",422007.0,20.2041737,73.8271949,9960846008.0,55,Corporate,
1877,27,"SMS Hospital,Khed","At BBHARE NAKA , TAL- KHED, DIST. RATNAGIRI",415709.0,17.7195576,73.3968076,7218877070.0,50,Corporate,
1878,19,SMT.NIMBUNABAI TIRPUDE HOSPITAL & RESEARCH CENTRE,"CHALKS COLONY,TEKA NAKA,KAMPTEE ROAD,NEAR TEKA NAKA SQUARE",440014.0,21.17947222,79.08972222,9822227922.0,100,Corporate,
1879,2,SOHAM MULTISPECIALITY HOSPITAL,,,20.76513778262712,77.0547006588983,,31,Corporate,
1880,1,SONAMBEKAR HOSPITAL,"SN 37/111,CHAITANYA NAGAR,AKOLE BYPASS ROAD,NEAR VITTHAL MANDIR,AHMADNAGAR",422605.0,19.612829,74.101239,9822325525.0,35,Corporate,
1881,7,SONTAKKE CHILDREN HOSPITAL,"Z1 207,RALEES PLOT IN FRONT OF SHANKARVAR HOSPITAL NEAR BUS STAND KHAMGAON ,RALEES PLOT,BULDHANA?%27,%27HSI51046%27)",444303.0,20.348496,76.113151,8308298222.0,30,Corporate,
1882,29,SPANDAN HOSPITAL,"Plot no - 2 ,VADUJ, SR.NO73/1 - 415506",415506.0,17.8150193,74.0894838,7588637007.0,60,Corporate,
1883,31,"SPANDAN MULTISPECIALITY HOSPITAL,Sangola,Solapur,Pvt","Old Medshingi Road, Wadhegao Naka, Sangola, Solapur- 413307",413307.0,17.405468,75.136661,8862050235.0,35,Corporate,
1884,25,SPARSH HOSPITAL,"SR NO 353,EMERALD BUILDING, Somatane phata, Parandwadi road, Mawal, Pune-410506",416008.0,16.68958333,74.24847222,8408986060.0,105,Corporate,
1885,24,SPARSH MULTISPECIALITY HOSPITAL,"OPP DURGESHWARI,GAVAHANE CHOWK,PARBHANI",431401.0,19.269567,76.774114,9422111330.0,50,Corporate,
1886,35,SPECTRUM HOSPITAL,SOM SHIV PLAZA ANJURPHATA BHIWANDI Thane 421302,421302.0,19.2103751,73.0464259,7506062222.0,32,Corporate,
1887,18,SRCC Childrens Hospital - Managed by Narayana Health,,,19.11878330833333,72.87393688666666,,63,Corporate,
1888,28,SREE TEKKE EYE CLINIC,"F8/9,SHIV PAVILION RAM MANDIR,SANGALI",416416.0,17.0348056,74.6018333,9822277044.0,5,Corporate,
1889,22,SRIGANGA HOSPITAL,"60 FEET ROAD, MALEGAON %E2%80%93 423203",423203.0,20.5533619,74.5080312,9877100800.0,50,Corporate,
1890,6,SRTR Medical College Ambejogai,"564,567 TO 572 PART OF 585,587 MOREWADI MOREWADI ROAD MEDICAL CAMPUS",431517.0,18.728364,76.389798,9423718936.0,518,Government,DMER
1891,22,SRV - RAJEBAHADUR HOSPITAL,"Plot No.13, 14/199, Tilak Road, shalimar nashik %E2%80%93 422001",422001.0,20.0082,73.80645,9607999688.0,70,Corporate,
1892,30,SSPM Medical Collage & Lifetime Hospital,"PADVE,SINDHUDURG",416534.0,16.1150605,73.6298553,9359392247.0,350,Corporate,
1893,20,STAR SURGICAL AND SUPER SPECIALITY HOSPITAL KINWAT NANDED,"Sai Nagar, Kinwat,Dr.Ambedkar Chowk, Kinwat - 431804",431804.0,19.2,77.4,8755595027.0,30,Corporate,
1894,9,SUDHA HEALTH CARE PVT LTD SUDHA MULTISPECILITY HOSPITAL AND CRITICAL CARE CENTRE DHULE,"Jai Hind Colony,?%20Deopur%20Landmark:%20Near%20Jai%20Hind%20Marati%20Schoo%27,%27HSP1810110011%27)",424005.0,20.9673566,74.7836721,9423192943.0,50,Corporate,
1895,13,SUDHAN MULITISPEACILITY HOSPITAL,JARGAON JARGAON ROAD PACHORA 424201,424201.0,20.67547,75.315,9356618892.0,30,Corporate,
1896,9,SUHARI HOSPITAL,"1114,1B, BEHIND GOVT REST HOUSE, NAVAPUR ROAD, PIMPALNER TAL. SAKRI %E2%80%93 424306",424306.0,20.92921,73.991,9552610999.0,30,Corporate,
1897,13,SULOCHAN Hospital LLP,"470, 1st floor, Near Ganpati MRI and City scan Center, Behind kabara petrol Pump, In front of Navjeevan super shop,Bhaskar, Pratap Nagar, Jalgaon, Maharashtra?%27,%27HSI99992%27)",425001.0,20.46428,75.004181,9766416494.0,0,Corporate,
1898,28,SUMANGAL HOSPITAL AND ICU,"West side to Pandit Vishnu Digambar School, Behind New S.T Stand, Keshavnagar, Palus, Sangli- 416310",416310.0,17.13,74.48,9423870032.0,30,Corporate,
1899,1,SUNDER NETRALAYA,"chaupati karanja,Ahmadnagar",414001.0,19.1627778,77.3060556,9822490091.0,7,Corporate,
1900,20,SUNRISE GLOBAL SUPERSPECIALITY HOSPITAL RARI PVT LTD,"ITI CORNER ,VIP ROAD, IN FRONT OF CORPORATION BANK, 431602",431602.0,19.2,77.4,9422170356.0,104,Corporate,
1901,29,SUNRISE HOSPITAL,"NEAR BALAJI DHABA ,BEHIND HOTEL SMILE , BOMBAY RESTAURANT CHOWK , 415001",415001.0,17.6881944,74.0068333,8208348935.0,30,Corporate,
1902,25,"SUNRISE HOSPITAL ,PUNE","GAT NO .213 214 OPP VANDE MATARAM SOCIETY, MOSHI DUDULGAON PUNE-413105",413105.0,18.4630616,74.5788829,7798980006.0,30,Corporate,
1903,1,SUPRASADH MULTISPECIALITY HOSPITAL,"GAT NO-210, DR.KOLPE NURSING COLLEAGE, KOLPEWADI-MADHI ROAD KOLPEWADI %E2%80%93 423602",423602.0,19.910234,74.376341,9890641886.0,300,Corporate,
1904,11,SUPREME SUPERSPECIALITY HOSPITAL,"RAILWAY CHOUKI ROAD, GONDIA -   441601",441601.0,21.484894,80.251647,9421809195.0,50,Corporate,
1905,19,SURAJ EYE INSTITUTE,"Plot No 559, Suraj Eye Institute, New Colony, New Colony, Nagpur, Maharashtra?%27,%27HSI5817%27)",440001.0,21.15219444,79.06916667,7122595600.0,30,Corporate,
1906,19,"SURAJ EYE INSTITUTE, Mihan nagar","PLOT NO.6. SECTOR NO. 21, MIHAN, OPPOSITE IIM, Nagpur %E2%80%93 441108",441108.0,20.859476,78.969831,9884093001.0,15,Corporate,
1907,15,"SURESH DESHPANDE MEMORIAL ORTHOPAEDIC HOSPITAL AND REHABILITATION CENTRE,GADHINGLAJ,KOLHAPUR,PVT","PLOT NO 8-A/5, HIDADUGI BAGH, AZAD ROAD, BEHIND CHURCH, Kolhapur- 416502",416502.0,16.60630039894737,74.30376235873685,9850622043.0,30,Corporate,
1908,19,"SURETECH HOSPITAL AND RESEARCH CENTRE LTD.(POLYTRAUMA,CARDIOLOGY AND SUPERSPECIALTY )","120/2k, Ashokvan, National Highway 7, post Rui, Jamtha, Nagpur, Maharashtra",441108.0,20.859476,78.969831,9822465988.0,120,Corporate,
1909,1,SURYAA MULTISPECIALITY HOSPITAL,"nagar-manmad road premdan chowk,ahmdnagar,414003",414003.0,19.1162222,74.7353611,9970241001.0,31,Corporate,
1910,22,SUSHILA MULTISPECIALITY HOSPITAL,"197/198,carbon naka,SR. no.193, carbon naka, near shivaji nagar, behind carbon company, satpur, carbon company,nashik",422012.0,19.988439,73.720725,9270339789.0,50,Corporate,
1911,22,SUSHRUT HOSPITAL,GAUTAM  NEW PANDIT COLONY SHARANPUR ROAD 422002,422002.0,20.00505,73.83675,9372624923.0,36,Corporate,
1912,22,SUVIDHA MULTISPECIALITY HOSPITAL,"MARKET YARD CHANDWAD , NEAR BUS STAND CHANDWAD - 423101",423101.0,20.3198,74.25785,9422759535.0,30,Corporate,
1913,25,SUVIDHA MULTISPECIALITY HOSPITAL & ICU,"PAP/G/60,BEHIND KASTURI MARKET, THERMAX CHOWK, CHINCHWAD, MAJJID ROAD, HAVELI, Pune- 411019",411019.0,18.6395,73.79586111,7350007557.0,40,Corporate,
1914,35,SUYASH HOSPITAL,"51 - Ugam Complex,SEAWOODS (WEST) SECTOR-40, D-MART LANE,Navi Mumbai",400706.0,19.035,73.022,7666707020.0,50,Corporate,
1915,22,SUYOG HOSPITAL,"2 ND FLOOR,PANCHAVTI,DINDORI ROAD ,KRUSHI UTPANNA BAZAR SAMITI SANKUL,NASHIK?%27,%27HSI27391%27)",422003.0,20.080116,74.109816,9422254748.0,50,Corporate,
1916,25,SWA. SUKHALALJI KHABIYA JAIN DHARMARTH HOSPITAL,"AZAD CHOWK RAJGURUNAGAR, KUMBHAR AALI ROAD RAJGURUNAGAR TAL KHED DIST PUNE-410505",410505.0,18.988502,73.63596,8208008136.0,42,Corporate,
1917,36,SWAMI SHRADDHANAND HOSPITAL,"3K , 3D &3E,NIRMAL VILLAGE,NIRMAL VILLAGE, NEAR SHANKARACHARYA SAMADI MANDIR , VASAI - WEST",401304.0,19.4002916,72.7776873,9223344950.0,50,Corporate,
